,Unnamed: 0,newspaper_name,date_of_incident,time_of_incident,incident_type,location,death_count,injury_count,type_of_vehicle1,type_of_vehicle2,driver_age,links,description_text,published_time,full_text
193,193,,,,,,,,,,,https://unb.com.bd/category/Bangladesh/reshmi-will-never-open-her-new-school-textbooks/39974,Reshmi will never open her new school textbooks,"January 01, 2020","The 10-year-old died after being run over by a truck in Kathgar Sea Beach intersection in Patenga thana on Wednesday morning.Reshmi, a student of Mirpara Government Primary School and daughter of Shahnur of Dompara area, was returning home after receiving new textbooks at her school.Jahirul Haque, in-charge of Chittagong Medical College Hospital police outpost, said the accident took place around 11am.Reshmi, critically injured in the accident, was taken to the hospital where doctors pronounced her dead."
194,194,,,,,,,,,,,https://unb.com.bd/category/Bangladesh/couple-killed-in-cumilla-road-crash/39956,Couple killed in Cumilla road crash,"January 01, 2020","The deceased were identified as Saiful Islam and Rumi Akter.The accident occurred around 9:30am when a Noakhali-bound private car carrying four people hit a roadside tree, said Abul Kalam Azad, officer-in-charge of Miabazar Police outpost.All four people, injured in the accident, were taken to Chouddagram Upazila Health Complex where the doctors pronounced Saiful and Rumi dead.The couple was returning home with Rumi’s expatriate brother Humayn Kabir from Dhaka Airport."
195,195,,,,,,,,,,,https://unb.com.bd/category/Bangladesh/1-killed-30-injured-in-natore-road-crash/39951,"1 killed, 30 injured in Natore road crash","January 01, 2020","The deceased was identified as Likhon, the assistant of a bus driver.The accident took place around 9:30am when a Rangpur-bound bus from Rajshahi collided head-on with another bus coming from opposite direction.Likhon was killed on the spot and 30 others were injured, said Asaduzzaman, deputy assistant director of Natore Fire Service and Civil Defence.The injured were taken to a local hospital. Three of them were shifted to Rajshahi Medical College Hospital for better treatment."
196,196,,,,,,,,,,,https://unb.com.bd/category/Bangladesh/jubo-dal-leader-killed-in-bagerhat-road-crash/39804,Jubo Dal leader killed in Bagerhat road crash,"December 31, 2019","The deceased was identified as Rakibul Islam Rakib, 36, son of Nurul Haque of Harinkhana area in the district town. He was joint general secretary of district Jubo Dal unit.Iqbal Bahar Chowdhury, officer-in-charge of Mongla Police Station, said a speeding truck ran over him when he was walking toward the road, leaving him critically injured around 2:30pm.Later, he was taken to Mongla Port Hospital where the doctors declared him dead, the OC added.Party members said he used to conduct his transport business at Mongla. The accident took place when he was returning home at noon."
197,197,,,,,,,,,,,https://unb.com.bd/category/Bangladesh/biker-killed-in-bagerhat-road-crash/39610,Biker killed in Bagerhat road crash,"December 29, 2019","The deceased was identified as Quamrul Islam, 35.Pannu Mia, officer-in-charge of Bagerhat Model Police Station, a motorcycle crashed into a stationary stuck around 11:30pm while vegetables were being unloaded from it, leaving three bikers injured.On information, firefighters rescued them and took them to Sadar Hospital where doctors declared Quamrul dead, said Masud Sarkar, deputy assistant director of Bagerhat Fire Service and Civil Defence.The two other injured -- Pintu Talukdar and Jakir Hossain -- were undergoing treatment at the hospital, he added."
198,198,,,,,,,,,,,https://unb.com.bd/category/Bangladesh/2-killed-in-kishoreganj-road-crash/39480,2 killed in Kishoreganj road crash,"December 27, 2019","The deceased were identified as Faizul Islam Chowdhury, 60, of Kanaighat in Sylhet and Zinat Khan, 50, of Mymensingh Sadar upazila and a nurse of Mymensingh Medical College Hospital.Police said a Mymensingh bound bus plunged into a roadside ditch when its driver lost control over the steering, leaving the two dead on the spot and 10 others injured at 4 am.During the rescue operation, another truck plunged into the same ditch as its driver lost control over the steering.Later, another Dhaka-bound bus collided head-on with an oil laden tank lorry injuring 10 more people at the same spot and plunged into the roadside ditch around 10:15 am.Kotiadi highway police in-charge DM Jahirul Islam said dense fog and slippery road caused the accidents."
199,199,,,,,,,,,,,https://unb.com.bd/category/Bangladesh/college-teacher-killed-in-rajshahi-road-crash/39416,College teacher killed in Rajshahi road crash,"December 26, 2019","The deceased was identified as Sirajul Haque, 45, son of late Idris Ali, hailing from Toukirpara in Taherpur municipality of Bagmara upazila.Quoting locals, SI Kajol Kumar Nandi, in charge of Shibpur police outpost of Poba highway police, said Sirajul died on the spot when a goods-laden truck hit him from behind while trying to overtake a motorcycle at 4:45 pm.The victim was a teacher of a local college, the SI added."
200,200,,,,,,,,,,,https://unb.com.bd/category/Bangladesh/two-youths-killed-in-keraniganj-road-crash/39302,Two youths killed in Keraniganj road crash,"December 25, 2019","The victims were identified as Russell, 22, and Rabbi, 25, residents of Mugda in the capital.Sub-inspector (SI) Sanjoy Kumar Malo of South Keraniganj Police Station said the two youths were going to Dhaka Central Jail to meet one of their imprisoned friends.The accident occurred around 12pm when a truck dashed their motorcycle killing them dead on the spot, he said.Police recovered the bodies and sent those to Sir Salimullah Medical College Hospital for autopsy, the SI added."
201,201,,,,,,,,,,,https://unb.com.bd/category/Bangladesh/3-killed-as-truck-hits-auto-rickshaw-in-kushtia/39206,3 killed as truck hits auto-rickshaw in Kushtia,"December 24, 2019","The deceased could not be identified yet.Quoting witnesses, police said the truck smashed the three-wheeler in front of Bheramara Powerhouse passenger shed around 3pm, leaving the auto-rickshaw driver dead on the spot and its five passengers injured.Later, two of the injured died on the way to hospital."
202,202,,,,,,,,,,,https://unb.com.bd/category/Bangladesh/3-killed-in-road-mishaps-in-madaripur/39142,3 killed in road mishaps in Madaripur,"December 24, 2019","The deceased were identified as: Anupom Biswas, 32, son of Antor Biswas of village Arua Kandi of Rajoir, and Biswajit Majumder, 35, son of Noresh Majumder of village Notakhola.The accident occurred when a three-wheeler ‘Mahendra’ fell into a ditch at Koidabari on Takerhat-Kodombari road at 1.30 in the afternoon.Family and hospital sources said Anupom Biswas died on the spot when the vehicle fell into the ditch after losing control. Critically injured Biswajit died on the way to Faridpur Medical College Hospital from Rajoir Hospital.Meanwhile, Biswajit’s daughter Dola, 3, was shifted to Faridpur Hospital from Rajoir hospital. Besides, six others were given treatment at Rajoir hospital.Khandker Shaukat Jahan, Officer-in-Charge of Rajoir police station, informed that the two bodies were sent to Madaripur Sadar Hospital for autopsy.Process of preparing case is on.In another road mishap in Madaripur sadar upazila, a housewife named Tanjila Akter, 30, died. She died on the spot on Khagdi-Chormuguria road of Madaripur sadar upazila at 11 am on Monday when a truck dashed her. The deceased Tanjila is the wife of Tipu Mia of village Ghotmajhi under sadar upazila.The body has been sent to Sadar hospital for postmortem."
203,203,,,,,,,,,,,https://unb.com.bd/category/Bangladesh/army-man-killed-several-others-wounded-in-khulna-road-crash/39117,"Army man killed, several others wounded in Khulna road crash","December 23, 2019","The deceased was identified as Lance Corporal Shafiqul Islam alias Shafique, 42.The injured include Sergeant Atiqur Rahman, Corporal Azizul Haque and sepyos Nadim, Imran, Tariqul, Russel, Faisal, Afzal, Raju and Arif.The injured were first taken to Dumuria Health Complex and then shifted to Khulna Medical College Hospital.Later, six of the injured were airlifted to the Combined Military Hospital in Dhaka, said an ISPR release.Mohammad Mahmud, officer-in-charge of Kharnia Highway Police Station, said the truck carrying 27 army personnel skidded off the road and plunged into the ditch around 3:30pm while approaching the Baliakhali Bridge on Khulna-Satkhira road after one of the front tyres got deflated.The army team was going to Satkhira from Barishal for the winter drill when the accident took place, he said.Aminul Islam Biplab, officer-in-charge of Dumuria Police Station, said police and firefighters were trying to salvage the truck."
204,204,,,,,,,,,,,https://unb.com.bd/category/Bangladesh/2-bangladeshis-killed-in-ksa-road-crash/38897,2 Bangladeshis killed in KSA road crash,"December 21, 2019","The deceased were identified as Sajjad Ahmed Saju, son of Abdul Baten of Langolbond Bajurbag area of Narayanganj Bondor upazila and Mesbah Uddin Fahim, son of Salauddin of Kolabag of the same upazila .Farabi Fahad , younger brother of Fahim and also a Saudi expatriate, said the accident occurred when a vehicle carrying the victims overturned on their way to Jeddah from Madinah.Three others – Motiur, Hanifa and Selim- were also injured in the accident. They also hail from Bondor upazila."
205,205,,,,,,,,,,,https://unb.com.bd/category/Bangladesh/man-killed-daughter-injured-in-jashore-road-crash/38709,"Man killed, daughter injured in Jashore road crash","December 20, 2019","The deceased was identified as Moazzem Hossain, 55, son of Mosharraf Hossain hailing from Birampur in Sadar upazila.According to relatives, Moazzem died on the spot when a bus of ‘Gorai Paribahan’ from Khulna crashed into their motorcycle when he along with his daughter Falguni Akhter was returning from Kaliganj.Dr Kajal Mallick, a physician at the emergency department of Jashore General Hospital, described the condition of Falguni as critical.Moniruzzaman, officer-in-charge of Kotwali Police Station, said the body was sent to the morgue."
206,206,,,,,,,,,,,https://unb.com.bd/category/Bangladesh/man-killed-in-city-road-crash/38639,Man killed in city road crash,"December 19, 2019","The deceased was identified as Ashrafuddin Dewan, 60, a resident of Mirpur area hailing from Gazaria upazila of Munshiganj.The accident took place around 9:30am.A bus of ‘Prajapati Paribahan’ hit Dewan when he was crossing road in front of Care Hospital, leaving him injured, said Bachchu Mia, inspector of Dhaka Medical College Hospital (DMCH) police outpost.Later, he was taken to DMCH where doctors pronounced him dead."
207,207,,,,,,,,,,,https://unb.com.bd/category/Bangladesh/youth-killed-in-magura-road-crash/38620,Youth killed in Magura road crash,"December 19, 2019","The deceased was identified as Yeasin Molla, 21, son of Mujibur Rahman of Mousha village in the upazila.The accident took place in the area around 9pm when the goods-laden truck hit a motorbike carrying two people, leaving Yeasin dead on the spot and injuring another.The injured Rashida Begum was taken to a local hospital."
208,208,,,,,,,,,,,https://unb.com.bd/category/Bangladesh/five-killed-in-rajbari-road-crash/38569,Five killed in Rajbari road crash,"December 18, 2019","Two of the deceased were identified as Mizanur Rahman of Bahadurpur in Pangsa upazila, and Forman Mandal of Kumarkhali upazila in Kushtia district.Quamrul Islam, officer-in-charge of Kalukhali Police Station, said the Kushtia-bound ‘Lalon Paribahan’ bus collided with the Daulatdia-bound ‘Arif Paribahan’ bus, leaving two passengers dead on the spot and 33 others injured.Of the injured, two died on the way to Rajbari Sadar Hospital and one to Faridpur Medical College Hospital."
209,209,,,,,,,,,,,https://unb.com.bd/category/World/hong-kong-bus-crash-kills-6-injures-more-than-30-others/38545,"Hong Kong bus crash kills 6, injures more than 30 others","December 18, 2019",The crash in the New Territories of Hong Kong that border mainland China tore away much of the left side of the bus and ripped a jagged hole in its roof.Police said three women and three men died. Fire services initially said four people were killed.Police said the bus was traveling on a highway from the town of Fanling.
210,210,,,,,,,,,,,https://unb.com.bd/category/Bangladesh/two-killed-in-sylhet-road-accident/38397,Two killed in Sylhet road accident,"December 17, 2019","The deceased were identified as Russel Ahmed, 26, son of Jamir Uddin of Kanaighat upazila, and Sabnur Begum, 19, daughter of Haris Uddin of Zakiganj upazila.Meer MdA bdunNaser, officer-in-charge of Jakiganj Police Station said a truck hit the motorbike at Zakiganj Hafsa Mazumder Mahila Degree College area, leaving the duo severely injured.Locals took them to Zakiganj Upazila Health Complex where doctors declared them dead, the OC added."
211,211,,,,,,,,,,,https://unb.com.bd/category/Bangladesh/two-killed-in-rajshahi-road-crash/38239,Two killed in Rajshahi road crash,"December 15, 2019","The deceased were identified as driver Sifat Hossain, 20, of Shah Makhdum Thana area and pedestrian Khayer Ali, 50, of Keshwarhat area in the upazila. Mostaque Ahmed, officer-in-charge of Mohanpur Police Station, said the accident took place around 8:45am when motorcyclist Sifat hit Khayer after losing control over the steering, leaving them critically injured. They were taken to Rajshahi Medical College Hospital where doctors declared the duo dead. The bodies were kept at the hospital morgue for autopsy, the OC added."
212,212,,,,,,,,,,,https://unb.com.bd/category/Bangladesh/3-killed-in-pirojpur-road-crash/37343,3 killed in Pirojpur road crash,"December 08, 2019","Two of the deceased were identified as freedom fighter Abu Jafar Ahmed, 65, and Belal Hossain, 35, residents of Devipur in the upazila.The Pathargaht-bound bus hit the auto-rickshaw around 5:30am, killing a passenger on the spot and injuring four others, said Maksudur Rahman, officer-in-charge of Mathbaria Police Station.The injured were sent to Sher-e-Bangla Medical College Hospital in Barishal where doctors declared two of them dead. On information, police recovered the bodies and sent those to hospital for autopsy.They also seized the bus but its deriver and helper managed to flee the scene, the OC added."
213,213,,,,,,,,,,,https://unb.com.bd/category/Bangladesh/madrasah-teacher-killed-in-road-accident/37099,Madrasah teacher killed in road accident,"December 06, 2019","The deceased Komoruddin, 50, a teacher of Matikumra madrasah under Jhikorgachha upazila and a resident of village Pachpota under Monirampur upazila.Tanvir Ahmed, son of the deceased, said his father driving motorcycle came to Moheshpur Bazar of Jhikorgachha upazila in the morning. At this time, a ‘nosimon’ coming from the opposite direction dashed him while he was talking to someone sitting on the motorbike by the side of the road. As a result, he received serious injury after falling on the road.After providing first-aid at a clinic at Bakra, the madrasah teacher Komoruddin was taken to Jashore 250-bed General Hospital where Dr Amio Das of emergency department declared him dead.He however said that the teacher died much before being taken to the hospital.Rashedul Islam, SI of Kotwali police station, confirmed the death of Komoruddin."
214,214,,,,,,,,,,,https://unb.com.bd/category/Bangladesh/college-student-killed-in-nawabganj-road-crash/36900,College student killed in Nawabganj road crash,"December 04, 2019","The deceased was identified as Badhan, 19, son of Ohidur of Agala village in the upazila. He was an 11th grader of Government Dohar-Nawabganj College.Sub Inspector Moshiur Rahman of Nawabganj Police Station, said Badhan along with his friend Rahat was returning home by a motorcycle in the afternoon.The accident took place in front of Pilot Higher Secondary Girls' School when the motorbike overturned after he lost control overt it , leaving the two and a pedestrian injured.Later, locals rushed them to Upazila Health Complex from where doctors referred Badhan to Sir Salimullah Medical College Hospital where doctors declared him dead, the SI added."
215,215,,,,,,,,,,,https://unb.com.bd/category/Bangladesh/2-motorcyclists-killed-in-rangpur-road-crash/36882,2 motorcyclists killed in Rangpur road crash,"December 04, 2019","The deceased were identified as Sabbir, 18 and Al Farazi, 7 of the area.Zafar Ali, officer-in-charge of Mithapukur Police Station, said the accident took place around 9:15 am when a fertilizer-laden trolley hit the motorbike they were riding, leaving Farazi dead on the spot and Sabbir injured.Later, he died on way to Upazila Health Complex.No one was arrested in this connection."
216,216,,,,,,,,,,,https://unb.com.bd/category/Bangladesh/truck-rams-auto-rickshaw-pedestrians-in-kurigram-2-dead/36658,"Truck rams auto-rickshaw, pedestrians in Kurigram; 2 dead","December 02, 2019","The deceased were identified as Halim, 30, of Khalilganj village, and Jubayer, 25, Togoraihat in Sadar upazila.Mahfuzur Rahman, officer-in-charge of Sadar Police Station, said the accident took place at noon when the driver of the Kurigram-bound truck from Nageswari lost his control over the steering, killing the duo on the spot.On information, members of Fire Service, Red Crescent and police recovered the bodies and rescued the injured. Six of the injured were sent to Rangpur Medical College Hospital."
217,217,,,,,,,,,,,https://unb.com.bd/category/World/6-killed-10-injured-in-bus-tank-truck-collision-in-indias-west-bengal/36424,"6 killed, 10 injured in bus-tank truck collision in India's West Bengal","November 30, 2019","The accident took place at Farakka in Murshidabad district, about 289 km north of Kolkata, the capital city of West Bengal.""Early today at around 5:00 a.m. (local time) a bus carrying passengers collided with an oil tank truck here killing six people and injuring 10 others,"" a police official posted in Murshidabad said. ""The dead include drivers of both the vehicles.""Police said the injured were removed to hospital, where condition of some of them was stated to be critical.""At the time of the accident, the passengers inside the bus were mostly asleep,"" the official said.According to police, the impact of the accident pointed out that both the vehicles were being driven rashly.Rescue officers had to cut the metal sides of the bus to take out the injured and bodies, police said.Deadly road accidents are common in India often caused due to overloading, bad condition of roads and reckless driving.Indian government this month released a report saying 151,471 people were killed in road accidents during 2018 across the country. The maximum deaths during road accidents in 2018 as per the report were caused due to overspeeding.Officials say on an average of over 400 deaths take place every day in India due to road accidents."
218,218,,,,,,,,,,,https://unb.com.bd/category/Bangladesh/three-killed-in-kushtia-road-crash/36185,Three killed in Kushtia road crash,"November 28, 2019","One of the deceased was identified as Hamidul Islam, 55 of Talbari area, while identities of two others could not be known yet. Abul Kalam Azad, officer-in-charge of Mirpur Police Station, said the accident took place around 6 pm, leaving three passengers of the auto-rickshaw dead on the spot."
219,219,,,,,,,,,,,https://unb.com.bd/category/Bangladesh/bus-truck-collision-leaves-2-dead-in-manikganj/35645,Bus-truck collision leaves 2 dead in Manikganj,"November 24, 2019","The deceases were identified as truck driver Md Saifullah Morol, 30, of Tala upazila in Satkhira district, and bus passenger Masudur Sheikh, 26, of Sadar upazila in Faridpur district. In-charge of Barangail Highway Police outpost Yamin-ud-Doula said the Faridpur-bound bus collided with the fish-laden truck around 12:30am, leaving the duo dead on the spot and 20 people injured. On information, police recovered the bodies while the injured were taken to hospital. The condition of five of the injured was stated to be critical, the OC added."
220,220,,,,,,,,,,,https://unb.com.bd/category/Bangladesh/college-boy-killed-in-barishal-road-crash/35640,College boy killed in Barishal road crash,"November 24, 2019","The deceased was identified as Abhoy Das, 17, a first year student of Infra Polytechnic Institute and son of Sajal Das of Sarikor in Gournadi upazila of the district. He used to reside in a mess in Sher-e-Bangla Road area of the city.Witnesses the truck hit the motorcycle at Nathullabad around 11:30pm, leaving Abhoy critically injured.He was taken to Sher-e-Bangla Medical College Hospital where doctors declared him dead.Officer-in-charge of Airport Police Station Zahid Bin Alam said they seized the truck but its driver managed to flee."
221,221,,,,,,,,,,,https://unb.com.bd/category/Bangladesh/eight-munshiganj-road-crash-victims-buried/35571,Eight Munshiganj road crash victims buried,"November 23, 2019","They were buried after a namaz-e-janaza at Brammangaon High School ground in Louhajang upazila around 10am.Ten people were killed in a fatal accident in Sreenagar upazila on Friday.The victims are – Abdur Rashid Bepari, 60, Liza, 22, her daughter Tabassum, 4, Ranu Akhter, 12, Keramat Ali, 70, Mofizul, 60, Runa Akter, 22, her son Tahsan, 3, Jahangir Alam, 45 and microbus driver Billal, 28.A seven-member investigation committee, led by Additional Deputy Commissioner Deepak Kumar Roy, has been formed to look into the accident. The committee has been asked to submit a report within seven working days."
222,222,,,,,,,,,,,https://unb.com.bd/category/Bangladesh/2-killed-in-gopalganj-road-crash/35296,2 killed in Gopalganj road crash,"November 21, 2019","The deceased were identified as Manjur Sardar, 50, of Tebaria in Sadar upazila and Mamun Shikdar, 60 of Kashiani upazila.The accident took place around 8:30am when the Dhaka-bound covered-van hit a van carrying two people, leaving the duo dead on the spot, said Sub-Inspector of Sadar Police Station Saiful Islam.On information, police recovered the bodies and seized the covered-van."
223,223,,,,,,,,,,,https://unb.com.bd/category/Bangladesh/police-constable-killed-in-cumilla-road-crash/35158,Police constable killed in Cumilla road crash,"November 20, 2019","The deceased was identified as Nur Hossain, 35, son of Abdul Haque of Laxmipur district.Nazrul Islam, officer-in-charge of Sadar Dakkhin Police Station, said the accident took place around midnight when a police vehicle plunged into a roadside ditch after being hit by a truck from behind.Nur was killed on the spot and three others injured.The injured Assistant Sub-Inspector Mohsin Ali, Constable Ismail Hossain and the driver Ershad Mia were taken to Cumilla Medical College Hospital.Later, a team of highway police chased down and arrested truck driver Jashim Uddin."
224,224,,,,,,,,,,,https://unb.com.bd/category/World/at-least-12-killed-in-slovakia-bus-crash-including-children/34420,At least 12 killed in Slovakia bus crash including children,"November 13, 2019","Online news site tvnoviny.sk reported that the bus was carrying high school students.Health Minister Andrea Kalavska, who was at the site, said four of the people killed were children, but did not release their ages.The accident occurred in Nitranske Hrnciarovce, about 100 kilometers (60 miles) east of the capital Bratislava at around 1 p.m. (1200 GMT) police and firefighters said.“At this moment, our thoughts are with the parents who lost their children,” Slovak President Zuzana Caputova said. “We all hope that the number of the victims won’t be rising.”Slovak Prime Minister Peter Pellegrini called it a “horrible tragedy” and said he was cutting short his visit to Cyprus and heading to the scene.He offered his condolences to the relatives of the victims.Firefighters originally put the number of dead at 13 but later lowered it to 12. The injured are treated in nearby hospitals.Photos from the scene published by the police showed an overturned truck on the road surrounded by gray stones it had been carrying as cargo and the bus on its side in a roadside ditch.The Arriva company said its bus was traveling from Nitra, near the scene of the accident, to the town of Jelenec. It didn’t say how many people were onboard. It said it is fully cooperating with the rescuers.Further details were not immediately available."
225,225,,,,,,,,,,,https://unb.com.bd/category/Bangladesh/faridpur-road-crash-death-toll-rises-to-4/34352,Faridpur road crash death toll rises to 4,"November 13, 2019","With them, four members of the same family have been killed in the accident.The deceased were identified as Dipali Paul, 60, and her grandchildren Joy Paul, 8, Jhinuk Paul, 5, and Koushik Paul, 12.Joy is the son of Sanjay Paul while Jhinuk and Koushik are the children of Tapas Paul. Sanjay and Tapas are siblings and work in the army.Saifuzzaman, officer-in-charge (investigation) of Madhukhali Police Station, said Dipali and Joy were killed on the spot and four others were injured after being run over by a vegetable-laden truck at Bagat Bazar in Madhukhali upazila around 6pm.The injured were taken to Faridpur Medical College Hospital where doctors pronounced Jhinuk dead and shifted others to Dhaka Medical College Hospital.Koushik died while being taken to Dhaka, the OC added."
