,Unnamed: 0,newspaper_name,date_of_incident,time_of_incident,incident_type,location,death_count,injury_count,type_of_vehicle1,type_of_vehicle2,driver_age,links,description_text,published_time,full_text
310,310,,,,,,,,,,,https://unb.com.bd/category/Bangladesh/2329-killed-in-2159-road-accidents-over-6-months-scrf-report/22180,"2,329 killed in 2,159 road accidents over 6 months: SCRF report","July 05, 2019","M Jahangir Alam, UNB Staff WriterIt says the road accidents took place on various highways, national, inter-district and regional roads between January 1 and June 30 across the country.Five people dies when a bus crashes into a truck from backside at Gangrai in Chauddagram upazila on Sunday, February 17, 2019. Shipping and Communication Reporters Forum (SCRF), a platform of journalists, prepared the report based on news carried by 22 national dailies, 10 regional newspapers and eight online news portals and news agencies.4 people have been killed in Sirajgan road accident on Tuesday , June 4, 2019.According to the report, 411 people, including 53 women and 71 children, lost lives and 725 others received injuries in 383 accidents in January last.A crushed auto rickshaw in CumillaSome 401 accidents occurred in February when 415 people were killed while 884 others injured. Among the deceased, 58 were women and 62 children.In March, 386 people, including 46 women and 82 children, were killed and 820 others injured in 384 road crashes.Some 327 accidents occurred in April which claimed 340 lives and left 610 others injured. Among the deceased, 38 were women and 53 children.Bus hits an autorickshaw in Shahrasti upazila on Sunday, Apr 28, 2019.In May, 338 people, including 47 women and 44 children, lost lives and 504 others received injuries in 297 accidents.A total of 367 road crashes took place in June claiming the lives of 439 people and leaving 818 others injured. Among the deceased, 49 were women and 69 children.A coal-laden truck overturns on the labour shed of a brick filed on Dhaka-Chattogram highway in Chouddagram upazila on Friday, Jan 26, leaving 13 people dead.Ashis Kumar Dey, president of the SCR Forum, told UNB that the forum identified 10 major reasons behind the rise in road accidents in the country.The reasons are: Dangerous race by drivers and reckless driving, contractual leasing out of vehicles to drivers or conductors on daily basis, employing drivers without having any license, lack of awareness among pedestrians and small vehicle drivers, especially motorcyclists, overloading and overtaking tendency of drivers violating traffic rules.Besides, long-time driving without any interval, lack of implementation of law to stop plying of unfit vehicles, violation of traffic rules on long routes, increase in motorcycles and three-wheelers on roads and highways, and carrying passengers and goods in locally-made motorised vehicles."
311,311,,,,,,,,,,,https://unb.com.bd/category/Bangladesh/2-killed-in-lalmonirhat-road-crash/21146,2 killed in Lalmonirhat road crash,"June 26, 2019","The deceased were identified as Nandu Chandra Roy, 55 and Rabiul Islam, 42, an auto-rickshaw driver of KakinaWabda Bazar in Kaliganj upazila.Saiful Islam, officer-in-charge of Aditmari Police Station said the accident took place around 7 am when a truck hit an auto-rickshaw carrying eight people, leaving two people ,including the auto-rickshaw driver, dead on the spot and seven others injured.The injured were taken to a local hospital from where four were shifted to Rangpur Medical College Hospital.Enraged by the accident, local people put up barricade on Lalmonirhat-Burimari highway for half-an hour."
312,312,,,,,,,,,,,https://unb.com.bd/category/Bangladesh/3-killed-in-natore-road-crash/20533,3 killed in Natore road crash,"June 21, 2019","The deceased were identified as Abdul Kader, 60, Ruhul Amin, 45, son of Abu Hossain and Rakibul Hasan, 24, son of Abdus Samad of Tarsh upazila in Sirajganj district.Delwar Hossain, officer-in-charge of Gurudaspur Police Station, said the accident took place when the Natore-bound goods-laden truck from Sirajganj rammed a stationary pick-up van from behind, leaving three workers, who were travelling in the van, dead on the spot.On information, police recovered the bodies and sent those to local hospital morgue for autopsy."
313,313,,,,,,,,,,,https://unb.com.bd/category/Bangladesh/motorcyclist-killed-in-city-road-crash/20201,Motorcyclist killed in city road crash,"June 16, 2019","The deceased was identified as Jubayer, 25, a resident of Hare Street of Wari.ASI Baby Ram of Wari Police Station said Jubayer received injuries when his motorcycle crashed into a road side pillar at Wari Post Office Goli around 1:00 am.He was rushed to Dhaka Medical College and Hospital where he succumbed to his injuries at around 2:00 am."
314,314,,,,,,,,,,,https://unb.com.bd/category/Bangladesh/bus-truck-collision-leaves-one-dead-in-gaibandha/20078,Bus-truck collision leaves one dead in Gaibandha,"June 14, 2019","The deceased was identified as Shafiqul Islam, 28, a bus helper and son of Saifullah of Kagkathi village in Razarhat upazila of Kurigram district.The accident took place in the area around 5:30 am when a Dhaka-bound Tomato-laden truck collided with a Kurigram-bound bus of ‘Fahmida Haq Paribahan’, leaving the bus helper dead on the spot and ten others injured, said Mehedi Hasan, officer-in-charge of Gobindaganj Police Station.On information, two firefighting units rushed in and sent the injured to Rangpur Medical College and Hospital."
315,315,,,,,,,,,,,https://unb.com.bd/category/Bangladesh/couple-killed-in-panchagarh-road-accident/20057,Couple killed in Panchagarh road accident,"June 13, 2019","The deceased were identified as Kaim Uddin, 45, a rickshaw van puller, and his wife Anowara Begum, 37.Robiul HasanSarkar, officer-in-charge of Debiganj Police Station, said when the van puller along with his wife was returning home from Debiganj town a speeding microbus hit the van, leaving the duo critically injured.Being rescued by locals, they were taken to Debiganj Upazila complex where doctors pronounced the husband dead and referred the wife to Rangpur Medical College Hospital. Later, she died on way to RMCH."
316,316,,,,,,,,,,,https://unb.com.bd/category/Bangladesh/man-killed-in-city-road-crash/19959,Man killed in city road crash,"June 12, 2019","The deceased was identified as Tofazzal Hossain, 60, an auto-rickshaw driver from Batenbari village of Bhola’s Borhanuddin upazila.Bacchu Mia, in-charge of Dhaka Medical College Hospital police camp, said the accident took place around 4:30am when a bus rammed the auto-rickshaw heading towards Dhanmondi.The driver and three passengers were injured in the accident.Later, they were taken to a local hospital where doctors pronounced Tofazzal dead around 6am."
317,317,,,,,,,,,,,https://unb.com.bd/category/Bangladesh/mother-daughter-among-4-killed-in-feni-laxmipur-road-crashes/19800,"Mother, daughter among 4 killed in Feni, Laxmipur road crashes","June 10, 2019","In Feni, a woman and her daughter were killed and three people injured as a speedy bus hit their auto-rickshaw at Tebaria village in Sadar upazila. The deceased were identified as Johora Begum, 36, and her daughter Faria Akhter, 16, of the village. The bus hit the CNG-run auto-rickshaw on Dhaka-Chattogram highway around 8pm, leaving five people injured, said chairman Mosharraf Uddin of Lemua Union Parishad. Locals took them to Chittagong Medical College Hospital where doctors declared Johora and Faria dead, he said.In Laxmipur, two members of a family were killed in a head-on collision between a human hauler and a motorcycle at Gugibari in Ramganj upazila. The deceased were identified as Md Sumon Hossain and his nephew Md Tamim Hossain, residents of the upazila. The human hauler collided with the motorcycle around 8pm, killing Tamim on the spot, said Md Anwar Hossain, officer-in-charge of Ramganj Police Station. Sumom was taken to upazila health complex where doctors pronounced him dead, the OC added."
318,318,,,,,,,,,,,https://unb.com.bd/category/Bangladesh/youth-killed-as-bus-driver-deliberately-runs-him-over-in-gazipur/19787,Youth killed as bus driver ‘deliberately’ runs him over in Gazipur,"June 09, 2019","The deceased was identified as Salauddin Ahmed, 35, son of late Shabuddin of Alu Bazar in the capital. He used to work as a driver at a local garment factory in Bagher Bazar staying at a rented house.Victim’s wife Parul Akhter said she and her husband were returning to Gazipur from her parents’ house in Mymensingh by an ‘Alam Asia Paribahan’ bus after celebrating Eid-ul-Fitr.Salauddin had a brawl with the bus helper over fare while the helper beat him inside the vehicle and threatened to throw him out of the running bus, she claimed.Parul said when the bus reached Bagher Bazar, the helper pushed Salauddin off the bus which was still running with she inside.As his wife was in the moving bus, the youth ran before the bus and asked the driver to stop it.However, the driver drove the bus over Salauddin, leaving him dead on the spot.The bus also drove away with his wife and dropped her 5 kms away as she was crying, said Parul.Officer-in-charge of Mawna Highway Police Station Delwar Hossain said they seized the bus but its driver and his assistant managed to flee.A case was filed in this regard."
319,319,,,,,,,,,,,https://unb.com.bd/category/Bangladesh/23-lose-lives-in-road-crashes-across-bangladesh-during-eid-holidays/19643,23 lose lives in road crashes across Bangladesh during Eid holidays,"June 06, 2019","Accidents on highways during the holiday are common in Bangladesh. They are mostly blamed on reckless driving, unfit vehicles and dilapidated road conditions.During the ongoing Eid vacation, road accidents left at least 99 others injured.The accidents were reported from Dhaka, Sirajgan, Bhola, Bogura, Bagerhat, Jhenaidah, Faridpur, Netrakona and Sylhet.Nine of those killed in the accidents were riding motorcycles.In Dhaka, a college student was killed and two others injured in a road crash on Mayor Hanif Flyover on Thursday noon.The deceased was identified as Emon, 22, son of Jerin Mia of Shonir Akhra area. He was an undergraduate student at Siddheswari College. Emon and his two friends were injured when the motorcycle they were riding fell from the flyover, said Inspector Bachchu Mia of Dhaka Medical College Hospital (DMCH) police camp. They were taken to DMCH where the doctors pronounced Emon dead. In Sirajganj, six people were killed in separate accidents in Ullapara and Raiganj upazilas on Thursday and Tuesday.Two people, including a bank official, were killed when a private car plunged into a roadside ditch on the Hatikumrul-Banpara highway at Harinchara Bazar of Ullapara on Thursday morning.The deceased were identified as Amarul Hossain, 42, senior officer of Agrani Bank Ltd, and Rubel, 45, driver of the private car.Abdul Quader Zilani, officer-in-charge of Hatikumrul Highway Police Station, said the private car carrying the bank official skidded off the road and fell into the ditch around 8:30am, killing Amarul on the spot and injuring Rubel.The driver died while being taken to hospital, he said.Four others were killed on Tuesday after a Gaibandha-bound bus plunged into a roadside ditch in Shimla area of Raiganj upazila.The deceased were identified as Fazlul Haque, 45, Hamidul Islam, 40, and Shahjahan Mia, 35, of Sundarganj upazila in Gaibandha. The other person is Ataur Sheikh, 30, of Mithapukur upazila of Rangpur.All four were killed on the spot when the accident took place on the Dhaka-Bogura Highway around 4:30am, said Raiganj Fire Service and Civil Defence acting Station Officer Sirajul Islam.Twenty-seven others injured in the accident were hospitalised in Sirajganj, Raiganj and Bogura.In Bhola, two motorcyclists were killed after a head-on collision with a bus at Boro Manik area in Borhanuddin upazila on Thursday noon. The deceased were identified as Iqbal, 26, and Sohag, 20, residents of Daulatkhan area of the upazila. A speeding bus hit the motorcycle around 2:15pm, killing them on the spot on Bhola-Charfesson road, said Enamul Haque, officer-in-charge of Borhauddin Police Station. In Bogura, a man was killed and 20 others were injured in a head-on collision between two buses on Bogura-Dhaka Highway at Mahipur in Sherpur upazila on Thursday.The deceased, identified as Shahidul Islam, 35, of the upazila, died on the spot.The accident occurred around 11am when a Bogura-bound bus from Dhaka crashed into another bus, said Humayun Kabir, officer-in-charge of Sherpur Police Station.In Bagerhat, two bikers were killed and two others injured in a road accident at Maheshpur in Morelganj upazila on Wednesday night.The deceased were identified as Swapan Saha, 25, son of Mahadeb Saha; and Shawon Khan, 24, son of Afzal Khan of Pirojpur district.AKM Azizul Islam, officer-in-charge of Morelganj Police Station, said the accident took place around 8:30pm when two motorcycles crashed into each other.The accident left the two riders of a bike dead on the spot and two of the other motorcycle injured. In Jhenaidah, two motorcyclists were killed and another injured after their motorcycle hit a roadside tree in Kotchandpur upazila on Wednesday morning.The deceased were identified as Bipul Hossain, 20, son of Alim Hossain of Jagannathpur village in Kotchadpur upazila; and Rana, 13, son of Asadul Islam of Jibannagar upazila in Chuadanga district.Pradip Kumar Mondol, sub-officer of Kotchandpur Fire Service Station, said Bipul, Rana and Firoz were going to Khalispur by a motorcycle.They were injured when their motorcycle hit a roadside tree around 9:30am at Khord-Khalispur.They were taken to upazila health complex where doctors pronounced Bipul and Rana dead. The injured Firoz Hossain was shifted to Jashore Medical College Hospital.In Faridpur, six people were killed and 15 others injured after a passenger bus hit a roadside tree in the Sadar upazila on Wednesday.Police said the accident occurred on the Dhaka-Khulna Highway's Dhudli area around 6:30am.Several passengers were killed on the spot after a Khulna-bound bus of AK Travel from Dhaka rammed into a roadside tree, said Kotwali police's in-charge SM Nasim.Some of the victims succumbed to their injuries while being taken to hospital.In Netrakona, two motorcyclists were killed and another was severely injured as a bus smashed their motorbike in Challisha Railgate area of Sadar upazila on Tuesday.The deceased were identified as Mojibur Rahman, Challisha union Awami League general secretary, and Shafiqul Islam of Bamonmoha village.Netrokona police chief Joydeb Chowdhury said the bus hit the motorcycle head-on in the afternoon that left three riders severely injured.Locals first took them to Sadar Hospital and then to Mymensingh Medical College Hospital where doctors referred them to Dhaka.Two of them died on the way to DMCH, SP added.In Sylhet, a woman was killed and 30 people were injured after a bus fell into a roadside ditch on the Dhaka-Sylhet Highway in Osmaninagar upazila on Tuesday.The deceased was identified as Khursheda Begum, 20, wife of Faruk Mia of Berigaon village in Sunamganj Sadar upazila.Officer-in-Charge of Sherpur Highway Police Station Jasim Uddin said the Sylhet-bound 'Shahjalal Paribahan' bus from Dhaka skidded off the road and plunged into the ditch at Goalbazar Brahmangram around 5am.Khursheda died on the spot.Firefighters from Tajpur Fire Station and highway police rescued the injured and hospitalised them."
320,320,,,,,,,,,,,https://unb.com.bd/category/Bangladesh/one-killed-in-bogura-bus-collision/19640,One killed in Bogura bus collision,"June 06, 2019","The deceased was identified as Shahidul Islam, 35, of the upazila.The accident occurred around 11am when a Bogura-bound bus from Dhaka collided head-on with another bus, killing one and injuring 20 others, said Humayun Kabir, officer-in-charge of Sherpur Police Station.The injured were taken to local hospital."
321,321,,,,,,,,,,,https://unb.com.bd/category/Bangladesh/cop-killed-in-savar-road-accident/19606,Cop killed in Savar road accident,"June 05, 2019","The deceased was identified as Nadim Hossain, 20, a constable of Industrial Police.Police said the policemen were returning to their barrack at Sreepur after the night-shift duty in the DEPZ’s new zone area. The truck hit the police van at Gonokbari, leaving four policemen injured. The injured were taken to Enam Medical College Hospital where doctors declared Nadim dead. Police arrested the truck driver and his helper."
322,322,,,,,,,,,,,https://unb.com.bd/category/Bangladesh/two-bikers-killed-in-netrakona-road-crash/19585,Two bikers killed in Netrakona road crash,"June 04, 2019","The deceased were identified as Mojibur Rahman, Challisha union Awami League general secretary, and Shafiqul Islam of Bamonmoha village. Police Super of the district Joydeb Chowdhury said the bus from the opposite direction crashed into the motorcycle in the afternoon that left three riders severely injured.Locals first took them to Sadar Hospital and then to Mymensingh Medical College Hospital where doctors referred them to Dhaka. However, two of them died on the way to Dhaka Medical College Hospital in the capital, SP added."
323,323,,,,,,,,,,,https://unb.com.bd/category/Bangladesh/one-killed-30-injured-in-sylhet-road-crash/19576,"One killed, 30 injured in Sylhet road crash","June 04, 2019","The deceased was identified as Khursheda Begum, 20, wife of Faruk Miah of Berigaon village in Sunamganj Sadar upazila.Officer-in-charge of Sherpur Highway Police Station Jasim Uddin said the Sylhet-bound ‘Shahjalal Paribahan’ bus from Dhaka skidded off the road and plunged into the ditch at Goalbazar Brahmangram around 5am after its driver lost his control over the steering.The accident left Khursheda dead on the spot and 30 other passengers injured, he said. Firefighters from Tajpur Fire Station and highway police rescued the injured and took them to hospitals."
324,324,,,,,,,,,,,https://unb.com.bd/category/Bangladesh/4-killed-in-sirajganj-road-crash/19563,4 killed in Sirajganj road crash,"June 04, 2019","The deceased were identified as Fazlul Haque, 45, son of Joynal Abedin; Hamidul Islam, 40, son of Bulu Mia; and Shahjahan Mia, 35, son of Elahi Box of Sundarganj upazila in Gaibandha. The other person is Ataur Sheikh, 30, son of Rahim Uddin of Mithapukur upazila of Rangpur.All four were killed on the spot when the accident took place on the Dhaka-Bogura Highway around 4:30am, said Raiganj Fire Service and Civil Defence acting Station Officer Sirajul Islam.The bodies were sent to Sirajganj General Hospital for autopsy while the injured were sent to different hospitals in Sirajganj, Raiganj and Bogura.Millions of people are going to their village homes to spend the long Eid-ul-Fitr holiday with their families. This exodus is putting much pressure on roads, rail and waterways.Accidents on highways during holiday rush are common in Bangladesh. They are mostly blamed on reckless driving, unfit vehicles and dilapidated road conditions."
325,325,,,,,,,,,,,https://unb.com.bd/category/Bangladesh/4-killed-in-dhamrai-road-crash/19552,4 killed in Dhamrai road crash,"June 03, 2019","Two of the deceased were identified as Mehedi Hasan, 28, of Magura and Nazrul Islam, 27, of Rajbari. The accident took place on Dhaka-Aricha Highway when a passenger bus collided head-on with the pickup van, said Dipak Chandra Shaha, officer-in-charge of Dhamrai Police Station.The accident killed four passengers of the pickup van on the spot and left four others injured. Two of the dead remain unidentified.On information, police seized the pickup van and recovered the bodies, the OC added."
326,326,,,,,,,,,,,https://unb.com.bd/category/Bangladesh/schoolboy-killed-in-manikganj-road-crash/19072,Schoolboy killed in Manikganj road crash,"May 27, 2019","The deceased was identified as Choton, 14, son of Pabel Khan of Muljan village in Sadar upazila. He was a student of Muljan High School. Yamin Uddoula, in-charge of Barangail Highway Police Outpost, said the victim along with his friend Samiul was going towards Aricha by a motorcycle.A Green Line Paribahan bus hit the bike from behind around 6:30pm, leaving them injured.Being rescued by locals, they were taken to Manikganj District Hospital where doctors pronounced Choton dead. Samiul was sent to Dhaka Medical College Hospital for better treatment."
327,327,,,,,,,,,,,https://unb.com.bd/category/Bangladesh/college-girl-killed-in-pabna-road-crash/18882,College girl killed in Pabna road crash,"May 23, 2019","The deceased was identified as Piya Khatun, 23, hailing from Azaltala village in the upazila. She was a second year student of Government Edward College in the district.Bahauddin Faruki, officer-in-charge of Ishwardi Police Station, said Piya and her father Ashraful Islam were going home at 4 pm riding on his motorcycle.When they reached Bansherbada Bazar, their motorcycle collided with a truck coming from the opposite direction, leaving her spot-dead and her father injured.The body was sent to Pabna General Hospital for an autopsy while her father was admitted to Ishwardi Upazila Health Complex Hospital.Although the truck driver is on the run, police detained his assistant."
328,328,,,,,,,,,,,https://unb.com.bd/category/Bangladesh/youth-killed-in-dhaka-road-crash/18511,Youth killed in Dhaka road crash,"May 18, 2019","The deceased was identified as Abdullah, 20, son of late Dulal of Bhairab upazila in Kishoreganj.Inspector Bacchu Mia, in-charge of Dhaka Medical College and Hospital police outpost, said Abdullah was hit by a truck while he was crossing road at 7.30 pm.He was taken to DMCH where doctor declared him dead at 9pm.The body has been kept in the morgue for autopsy."
329,329,,,,,,,,,,,https://unb.com.bd/category/Bangladesh/3-workers-killed-in-cnawabganj-road-crash/18337,3 workers killed in C’Nawabganj road crash,"May 15, 2019","The deceased were identified as Shaidul Islam, 18, son of Abdur Rajjak, Rakib Hossain, 32, son of Abdul Manna, and Mojaffar Hossain, 62, son of late Montaj Ali of Dhobra village in Shibganj upazila. Jasim Uddin, officer-in-charge of Gomastapur Police Station, said some 10 to 12 workers were returning with paddy from Barind Tract.The accident took place as the human hauler overturned and fell into a ditch after its driver lost his control around 10:30pm.Three of them died on the spot and six others injured critically as the paddy-sacks collapsed them.Later, the injured were taken to Rajshahi Medical College Hospital and Upazila Health Complex immediately, the OC added."
330,330,,,,,,,,,,,https://unb.com.bd/category/Bangladesh/2-workers-killed-in-rajshahi-road-crash/18233,2 workers killed in Rajshahi road crash,"May 13, 2019","The deceased were identified as Rashedul, son of Polan, and Mohon, son of Awlad Hossain, hailing from Daulatpur in Kushtia district. They were cousins.Abul Hossain, officer-in-charge of Mohonpur Police Station, said that a group of workers went to Nagaon from Kushtia 22 days ago to work in the paddy field.The accident took place as the minitruck carrying them overturned at medical intersection while they were returning to Kushtia, killing the duo on the spot and injuring two others.Besides, the injured – Shafiqul Islam and Sagor – were admitted to Rajshahi Medical College Hospital."
