date_of_incident,time_of_incident,published-time,incident_type,location,death_count,injury_count,type_of_vehicle1,type_of_vehicle2,description_text,full_text,published-time,link
2021-06-27,12:25:00,"27 Jun 2021, 09:07",,"Benapole highway, Jessore",4.0,1.0,private car,truck,Four people killed in Jashore road accident,"Four people were killed and another injured on Sunday in a collision between a truck and a private car at Dhopakhola Nimtala on Jessore-Benapole highway in sadar upazila, reports UNB. The deceased are Sadman, 27, son of Iqbal Chowdhury of Bayazid police station, Naim, 35, son of Ismail, Syed, 45, son of Badshah and Shahabuddin, son of Zahir Ahmed of the same area. According to highway police, five people were going to Benapole from Chattogram in a private car to buy cows. The private car collided with a Jashore-bound truck when it reached Dhopakhola at 12:25pm, leaving four people dead on the spot. Ali Newaz, who sustained injuries, was admitted to Jessore General Hospital. The driver managed to escape with the truck after the accident. Navaran highway police SI Md Wahid said the bodies were recovered.","27 Jun 2021, 09:07",https://en.prothomalo.com/bangladesh/accident/four-people-killed-in-jashore-road-accident
2021-06-27,12:00:00,,head-on,Chattogram,,1.0,,Pedestrian,,,,
2021-06-27,10:30:00,15 hours ago,head-on,Chattogram,,1.0,Van,Motorcycle,2 killed in Sitakunda road crashes,"Two people, including a biker, were killed in separate road accidents in Chattogram’s Sitakunda on Sunday. The deceased were identified as Sayed Hossain Rony, 38, son of one Golam Chandani of Mirsarai and Nirmal Das, 50, of Muhuri Para village of Kumira union. The incidents occurred in upazila’s Kumira at 10:30 am and in front of Ghoramora Islamic University at 12:00 pm. According to police, Sayed Hossain Rony was killed on the spot when his motorcycle was hit by a Chittagong-bound covered van in front of the Islamic University in Ghoramara area, right after loading oil from a nearby petrol pump. On the other hand, while crossing the road near Ilias Petrol Pump in Kumira, a pedestrian, Nirmal Das, was hit by a Chittagong-bound vehicle carrying bitumen. He died on the spot. Baro Aulia Police Station Highway Police OC Nazrul Islam said that the bodies were recovered from the spots and the vehicles were seized.",15 hours ago,https://en.prothomalo.com/bangladesh/accident/2-killed-in-sitakunda-road-crashes-2
2021-06-26,12:45:00,"26 Jun 2021, 09:30",head-on,Gulshan,2.0,2.0,Van,PushCart,Road crash claims two in Gulshan,"Two workers of a pushcart were killed leaving two more injured as a pickup van hit them at Gulshan in the capital on Saturday. The deceased identified as Arif Uddin (32) and Abdur Rahman Babul (44), reports UNB. Sub-inspector (SI) Mohammad Nuruzzaman of Gulshan police station said the accident took place at 12.45 pm. Being informed, critically injured Arif and Babul were rushed to Dhaka Medical College Hospital where the on-duty physician declared them dead at around 2:45 pm. Injured worker Kashem said he along with the three other was going to Coca-cola from Kalachandpur carrying rubbish on the pushcart when a pickup van hit it near Kalachandpur crossing. The dead bodies kept at the DMCH morgue for autopsy. ","26 Jun 2021, 09:30",https://en.prothomalo.com/bangladesh/accident/road-crash-claims-two-in-gulshan
2021-06-25,13:30:00,"25 Jun 2021, 09:01",rear-end,Jashore,0.0,2.0,motocycle,Truck,Two Ansar men killed in Jashore road crash,"Two Ansar men on Friday were killed in as their motorcycle hit a stationed truck Abhaynagar upazila of Jashore, reports UNB. The deceased were identified as Shahadat Hossain, 38, of Gazipur’s Kaliakoir upazila, and Nazrul Islam, 34, of Kushtia’s Mirpur upazila. Shahadat Hossain was a member of Jashore Navaran Ansar Battalion and Nazrul Islam of Khulna's Elahipur Ansar Battalion. The incident occurred in Alipur area of Jashore-Khulna highway. Citing witnesses, police said that Shahadat and Nazrul were going to Jashore on a motorcycle. At around 1.30 pm in Alipur area of Abhaynagar upazila it rammed into the back of a truck parked on the highway leaving Nazrul dead on the spot. Locals rushed Shahadat to Abhaynagar Upazila Health Complex where the emergency department physician declared him dead. Nawapara highway police officer-in-charge (OC) Mohammad Abdullah said the driver managed to escape with the truck after the accident. Attempts were being made to arrest him. The bodies were sent to Jashore General Hospital morgue for autopsy. An unnatural death was registered at Abhaynagar police station.","25 Jun 2021, 09:01",https://en.prothomalo.com/bangladesh/accident/two-ansar-men-killed-in-jashore-road-crash
2021-06-24,,"24 Jun 2021, 20:00",head-on,Naogaon,2.0,0.0,Truck,Bus,"Truck driver, helper killed in Naogaon road crash","Two people were killed in a head-on collision between a truck and a bus at Satihat Panchamitala in Naogaon’s Manda Upazila on Thursday afternoon, police said, UNB reports. The deceased were identified as truck driver Masud Rana, 28, from Rajshahi and helper Omar Russel, 20, from Noakhalli. Shahinur Rahman, Officer-in-charge (OC) of Manda Police Station, said a mini truck carrying poultry was heading towards Rajshahi from Naogaon and collided head-on with a passenger bus at Satihat Panchamitala in Manda in the afternoon. Two people in the truck died on the spot. No casualties have been reported from the bus. A case has been filed with Manda police station in this regard, the OC added.","24 Jun 2021, 20:00",https://en.prothomalo.com/bangladesh/accident/truck-driver-helper-killed-in-naogaon-road-crash
2021-06-23,20:00:00,"23 Jun 2021, 01:29",,Mymensingh-Tangail highway,3.0,0.0,motocycle,truck,Three killed in  Mymensingh road accident,"Three people, including a motorcycle rider, were killed in a road accident on the Mymensingh-Tangail highway in Rasulpur area under Muktagachha upazila of the district on Tuesday, reports BSS. The deceased were identified as motorcycle rider Selim, 25, Sabuj, 20, and Onta, 19. All the deceased are from Charipara village of Muktagachha upazila. Officer-in-charge (OC) of Muktagachha police station, Dulal Akand said the accident occurred when a speedy truck crushed with a motorcycle in the area around 8.00pm, leaving motorcycle rider Selim dead on the spot and injuring the other riders. Being informed, police rushed to the spot and recovered the dead body. The wounded were taken to Muktagachha Upazila Health Complex where on-duty doctors declared Sobuj dead. Onta was shifted to Mymensingh Medical College Hospital (MMCH) as his condition deteriorated. Later, he succumbed to his injuries at the hospital, the OC said. Police has detained the truck along with its driver, said the police officer.","23 Jun 2021, 01:29",https://en.prothomalo.com/bangladesh/accident/three-killed-in-mymensingh-road-accident
2021-06-22,,"22 Jun 2021, 00:06",Lost control,Natore,1.0,3.0,Truck,,Mango trader killed in road crash,"A 50-year-old mango trader was killed when a truck he was travelling in crashed into a tree at Tebaria bypass in Natore early Tuesday, UNB reports. The deceased was identified as Selim Hawladar, a resident of Madaripur district. Three more persons sustained injuries in the accident that occurred after the truck driver lost control of the vehicle, police said. Locals rescued all the victims and rushed them to Natore Sadar Hospital, where Selim was declared dead on arrival. Abdul Hakim, officer-in-charge (investigation) of Natore police station, said no case has been filed in connection with the accident.","22 Jun 2021, 00:06",https://en.prothomalo.com/bangladesh/accident/mango-trader-killed-in-road-crash
2021-06-20,22:00:00,"20 Jun 2021, 23:06",Lost control,Chattogram,2.0,3.0,motocycle,,2 motorcyclists killed in Chattogram road crash,"Two motorcyclists were killed and another was injured in a road accident at Economic Zone area in Mirsarai upazila of Chattogram district on Sunday night. The deceased were identfied as Zabed Hossain, 30 and his nephew Nazmul Hossain, 12 of the upazila. The accident occurred around 10:00 pm when the motorbike off the road after its rider lost control over it, leaving three people injured, said Shilbrata Barua, assistant sub-inspector of Chattogram Medical College and Hospital police camp. Later, they were taken to the hospital where the physicians declared the two dead.","20 Jun 2021, 23:06",https://en.prothomalo.com/bangladesh/accident/2-motorcyclists-killed-in-chattogram-road-crash
2021-06-19,00:00:00,"19 Jun 2021, 21:28",head-on,Narsingdi,5.0,7.0,truck,MicroBus,"Five killed in Narsingdi truck-microbus collision, 7 injured","At least five people including two children were killed and seven others injured in a collision between a truck and a microbus in Narsingdi Sadar upazila. The accident took place on Ghorashal-Tongi regional road in Panchdona area that falls under the jurisdiction of Madhabdi police station in Sadar upazlia around 12:00am on Sunday. All of the deceased and injured are from Zirabo area of Dhaka’s Ashulia and they are relatives. The deceased were Mukti Akter, 30, her eight-year-old son Sadekul, Rubi Akter, 40, her three-year-old daughter Rahima, and Rokyea Begum, 52, while the injured were Razia, 40, Saifa, 12, Ishrat Jahan, 12, Samsunnahar, 60, Sharmin, 35, Rashid, 40, and deceased Rubi Akter's husband Kazimuddin, 52. All of them were the passenger of the microbus. Quoting the injured, police said there were 14 people including the driver in the microbus. All of the passengers were relatives. The law enforcement further said the passengers went to the shrines in Sylhet from Ashulia on Saturday by the microbus. They were returning from there on Sunday. A truck, coming from opposite direction, collided with the microbus at Sakura intersection in the Panchdona area, leaving the casualties. The crash left the microbus twisted. The injured were rushed to the Narsingdi Sadar Hospital.  Narsingdi Sadar Hospital’s emergency department physician Md Asaduzzaman said nine people, including the child Sadekul, were brought to the hospital. Sadekul succumbed to his injuries on the way to the hospital. Four out of eight injured have been shifted to the capital for better treatment, he added. According to police and physicians, Mukti and Rahima died on the spot. One of the injured Rubi Akter succumbed to her injuries on the way to Dhaka. Relatives also tried to take Rokey Begum to Dhaka from the spot. But she died on way to the hospital, sub-inspector of Madhabdi police station Zahidul Islam confirmed Prothom Alo. Narsingdi’s additional superintendent of police (administration) Imamul Haque said five people were killed in the accident. The truck involving the accident was seized. However, its driver has escaped. Efforts are on to detain the driver, he added.","19 Jun 2021, 21:28",https://en.prothomalo.com/bangladesh/accident/five-killed-in-narsingdi-truck-microbus-collision-7-injured
2021-06-19,,"19 Jun 2021, 09:29",,old Dhaka-Narayanganj highway,2.0,,battery-run auto-rickshaw,covered van,2 killed in Fatullah road accident,"Two passengers of a battery-run auto-rickshaw were killed when it collided with a covered van on the old Dhaka-Narayanganj highway adjacent to Masdair Amena Garments of Fatullah, reports UNB. The deceased have been identified as Afasar Uddin, 56 and Abbas Uddin, 48. Rakibuzzaman, officer-in-charge, Fatullah model police station confirmed the news. ""The locals rushed the injured to Narayanganj General Hospital where the duty physician declared two of them dead, "" he said. ""Locals held the driver of the covered van and handed him over to police."" At least 468 people were killed and 507 others injured in 432 road accidents across the country in April amid the nationwide lockdown, according to a report of Bangladesh Jatri Kalyan Samity.  Besides, six more people were killed in eight accidents on rail tracks, 38 people were killed and nine others injured in 14 accidents on river routes while two others went missing during the month. ","19 Jun 2021, 09:29",https://en.prothomalo.com/bangladesh/accident/2-killed-in-fatullah-road-accident
2021-06-19,,"19 Jun 2021, 02:22",head-on,Bogura,3.0,3.0,Bus,Auto Rickshaw,"Couple, new born granddaughter killed in Bogura road crash","A couple and their new born granddaughter were killed and three others injured as a bus collided head-on with a CNG-run auto-rickshaw in the district on Saturday, reports UNB. The deceased were identified as Ashraf Ali, 50, his wife Parul Khatun, 45, and their one and a half months old granddaughter Rezwan. The accident occurred at Hathibanddha of Shibganj Upazila around 9:00am when the Rangpur-bound bus of “Ahsan Paribahan” from Dhaka had a head-on collision with the Bagura-bound auto-rickshaw. Those three were killed on the spot, said Md Mizan, sub-inspector of Shibganj police station. The three injured were taken to Shaheed Ziaur Rahman Medical College and Hospital, he added. Fatal road accidents are common in Bangladesh. Road accidents during last Eid-ul-Fitr holiday rush claimed 323 lives in just 15 days, according to Bangladesh Jatri Kalyan Shamiti.","19 Jun 2021, 02:22",https://en.prothomalo.com/bangladesh/accident/couple-new-born-granddaughter-killed-in-bogura-road-crash
2021-06-18,,"18 Jun 2021, 09:58",,Chattogram and Rangamati,7.0,22.0,,,"7 killed in three road accidents in Chattogram, Rangamati","At least seven people, including women and children, have been killed in three separate road accidents in Chattogram and Rangamati on Friday, reports UNB. About 22 more people were injured in these accidents. The accidents occurred in EPZ Steel Mills Bazar and Shikalbaha area of Karnafuli police station on Friday. According to police, three people, including a woman and a child, were killed when a bus overturned at Steel Mills Bazar area under EPZ police station around 12:00pm.   Witnesses said a speeding bus hit a rickshaw at Sailo Road and crushed the pedestrians, losing its control while escaping at Friday noon. EPZ police officer-in-charge Utpal Barua said the mob detained the driver and helper of the bus and handed them over to the police. The bus was also seized.  Meanwhile, three people were killed and at least 20 others injured in a head-on collision between two buses at Shikalbaha Chaumuhoni area of Karnafuli upazila. However, the identities of the injured were not immediately known.  Police TI Anwar Azim said two buses collided while overtaking a CNG, injuring several passengers of the two buses. Two of them died.  In Rangamati, a ninth-grader schoolgirl was killed in a head-on collision between a motorbike and a Jeep at Bangalhaliya's Shafipur area of Rajasthali-Chandraghona highway on Friday morning.  The deceased was identified as Opruiching Marma, 18, daughter of Mongbaching Marma of Farua union in Bilachhari upazila. She is a ninth-grader student of Chitmaram High School.  Two people including a motorcyclist were injured in the accident.  Md Iqbal Bahar Chowdhury, officer-in-charge (OC) of Chandraghona police station, said legal action is being taken in this case. Police are searching for the jeep.","18 Jun 2021, 09:58",https://en.prothomalo.com/bangladesh/accident/7-killed-in-three-road-accidents-in-chattogram-rangamati
2021-06-18,,,head-on,Chattogram,3.0,20.0,Bus,Bus,,,,
2021-06-18,,,head-on,Rangamati,1.0,2.0,motocycle,Jeep,,,,
2021-06-18,,,head-on,Chattogram,3.0,,Bus,Auto Rickshaw,,,,
2021-06-18,,"18 Jun 2021, 20:33",Ran over,Dhaka,1.0,1.0,Bus,Pedestrian,"Dhaka road crash kills mother, injures daughter","A mother was killed and her daughter injured in the capital Friday night as a bus ran over them when they were crossing a road. The incident happened in front of the Suvastu NAZAR Valley Shopping Mall in Gulshan, reports UNB. The deceased was identified as Sheikh Fauzia Ripa, 42. The injured was a college student at BAF Shaheen College and was identified as Anisha, 18. According to witnesses, the pedestrians took the mother and daughter to the emergency unit of Dhaka Medical College where the on-duty physician declared Ripa dead at 10 pm. Anisha is currently undergoing treatment in critical condition at the hospital. Bacchu Miah, inspector of Dhaka Medical College Hospital police outpost, confirmed the death to UNB.","18 Jun 2021, 20:33",https://en.prothomalo.com/bangladesh/accident/dhaka-road-crash-kills-mother-injures-daughter
2021-06-11,16:00:00,"11 Jun 2021, 01:41",,Chattogram,1.0,0.0,microbus,,ASI killed in Chattogram road accident,"An assistant sub-inspector (ASI) of police, Kazi Md Salahuddin, was killed in a road accident early Friday at Meheraj Khan Ghata in Chandgaon, Chattogram. He had been on the way to recover a consignment of local liquor when he was hit by a vehicle and killed. The deceased Kazi Md Salahuddin was the ASI of Chandgaon police station. He was the son of Kazi Nader Zaman of South Jaipur of the sadar thana in Lakshmipur district. Officer-in-charge (OC) of Chandgaon police station, Mustafizur Rahman, told Prothom Alo on Friday morning that Salahuddin had been on night duty in Maulvi Pukurpar, C&B and adjacent areas. He was tipped off about a black microbus (registration no. Dhaka Metro Cha 15- 3665) carrying local liquor from the hill tracts to Chattogram city. The OC further said Salahuddin and his driver constable Md Masum signalled the microbus to halt in front of the Meheraj Khan Ghata petrol pump in Chandgaon police station around 4:00 am. The microbus slowed down and the two members of the police went forward. But the microbus driver suddenly picked up speed and the vehicle hit Salahuddin. He fell to one side of the road, receiving injuries in his head, back and other parts of his body. Masum was injured too. OC Mustafizur Rahman said Salahuddin was taken to Chattogram Medical College Hospital. Masum is under treatment there. The microbus has been seized by the police, but the driver and his associates fled. Around 730 litres of local liquor was recovered from the vehicles. He said, a drive is on to arrest the driver and the others in the vehicle.","11 Jun 2021, 01:41",https://en.prothomalo.com/bangladesh/accident/asi-killed-in-chattogram-road-accident
2021-06-09,,"09 Jun 2021, 21:58",Lost control,Panchagarh,2.0,1.0,Van,Van,2 die in Panchagarh road crash,"Two persons were killed and another one was injured in a collision between a covered van and a pick-up van on Panchagarh-Tentulia highway on Wednesday night, police said on Thursday. The deceased were identified as Rubel, 25, of Kalandiganj Boalmari in Tentulia, and Swapan, 22, of Phultala in Boda upazila, reports UNB. The accident occurred in the Buraburi area of Panchagarh’s Tentulia upazila. “A Panchagarh-bound covered van hit a pick-up van after its driver lost control of the vehicle. The collision left two persons dead on the spot,” said Abu Sayem, officer-in-charge of Tentulia Model police station. “The injured person has been admitted to a local hospital,” he said, adding that a probe “is underway”.","09 Jun 2021, 21:58",https://en.prothomalo.com/bangladesh/accident/2-die-in-panchagarh-road-crash
2021-06-04,22:00:00,"05 Jun 2021, 05:04","OverSpeeding, Ran over",Naogaon,2.0,,Truck,Motorcycle,Two bikers killed in Naogaon road crash,"Two men returning home on a bike were crushed to death by a speedy truck on the Rajshahi-Naogaon highway in Bijoypur on Friday night. The deceased were identified as Saidur Rahman, 35, son of Nazir Uddin of Badalghata village under Manda Sadar upazila, and Alfaz Hossain, 35, son of Ashar Ali of the same village. Manda police station's officer-in-charge Shahinur Rahman said that the accident occurred around 10:00pm when the victims were returning home from work.  ""A speedy truck hit the bike as its driver failed to spot them. The duo died on the spot after getting crushed under the wheels of the truck,"" he said. Local police rushed to the spot soon after being informed by passersby and sent the bodies to the local hospital morgue for an autopsy. ""The bodies have been handed over to their family members,"" the OC said. A case has been filed at Manda police station in connection with the accident.","05 Jun 2021, 05:04",https://en.prothomalo.com/bangladesh/accident/two-bikers-killed-in-naogaon-road-crash
2021-06-04,14:45:00,"04 Jun 2021, 09:12",head-on,Gopalganj,2.0,3.0,microbus,Van,2 killed in Gopalganj road crash,"At least two people were killed and three others injured in a road crash in Gopalganj's Kashiani as a microbus and a pickup van collided head-on, reports UNB. The deceased were identified as NRBC Bank minibus driver Zafar Hossain, 42, son of Erfan in Bakerganj, Barishal and the pickup van driver Imran, 35, son of Mosharraf Hossain of Kathi village under Gopalganj Sadar upazila. The accident occurred near Dhusar bridge in Kashiani upazila on the Dhaka-Khulna highway at around 2:45pm on Friday. Abu Naeem, inspector of Bhatiapara outpost of Faridpur's Bhanga highway police station, said a NRBC Bank microbus was going from Dhaka to Satkhira. The incident took place when the microbus collided head-on with a pickup van coming from the opposite direction in Kashiani upazila.  The driver of the microbus Zafar Hossain died on the spot. Police and fire service members rescued the pickup van driver and took him to Kashiani Upazila Hospital where he died while undergoing treatment. ","04 Jun 2021, 09:12",https://en.prothomalo.com/bangladesh/accident/2-killed-in-gopalganj-road-crash
2021-06-03,21:00:00,"03 Jun 2021, 22:40",,Savar,4.0,,,,4 sustain burns in Savar factory accident,"In a freak accident, four workers sustained burn injuries when hot water from a boiler spilled on them at a factory in Savar on Thursday, reports UNB. The injured workers have been identified as Rashedul, Hasan, Sandwip and Anwar. They are being treated at Enam Medical College and Hospital. The accident happened at SDS Yarn Dyeing factory in the Kuturia area of Savar’s Ashulia around 9:00 pm on Thursday. Hospital’s medical officer Nahiyan Binte Mojib said, “Rashedul and Hasan have been shifted to the hospital ICU as they sustained 60 per cent burns. The other two victims are being treated in the general ward.” Family members of the injured said that hot water from the factory’s boiler suddenly spilled on them, leading to the accident. Officer-in-Charge of Ashulia police station Kamruzzaman said that he was aware of the accident at the factory.","03 Jun 2021, 22:40",https://en.prothomalo.com/bangladesh/accident/4-sustain-burns-in-savar-factory-accident
2021-06-03,,"03 Jun 2021, 02:35",rear-end,Gazipur,1.0,1.0,Van,Truck,Teen killed in Gazipur road crash,"A 13-year-old boy died and another person sustained serious injuries after their pickup van crashed into a truck on the Dhaka-Mymensingh highway in Gazipur on Thursday morning. The deceased has been identified as Maruf, the helper of the pickup van. The vehicle’s driver has been injured in the accident. Eyewitnesses said the pickup van was travelling at a very high speed and it hit the Mymensingh-bound truck from behind in the Member Bari area of Gazipur Sadar after its driver lost control of the vehicle. The impact of the crash was such that Maruf died on the spot, police said. “The severely injured driver has been admitted to Mymensingh Medical College Hospital,” Md. Kamal Hossain, Officer-in-Charge of Mauna Highway Police Station, said. The body of the helper has been sent to Shaheed Tajuddin Ahmed Medical College Hospital for an autopsy, the OC added.","03 Jun 2021, 02:35",https://en.prothomalo.com/bangladesh/accident/teen-killed-in-gazipur-road-crash
2021-06-03,,"04 Jun 2021, 00:21",head-on,Thakurgaon,2.0,6.0,auto-rickshaw,3-wheeler,"2 killed, 6 hurt in Thakurgaon road crash","Two persons were killed and six others injured in a head-on collision between a three-wheeler and an auto-rickshaw in the Pallibidyut area of Thakurgaon Sadar on Thursday afternoon. Police said on Friday that one of the deceased was a businessman from Bogura district. The identity of the others has not yet been known. Eyewitnesses said while one person died on the spot in the impact of the collision, seven others—all passengers of the two vehicles—sustained injuries. Local residents and fire service personnel rushed the victims to the nearby Adhunik Sadar Hospital, where one of the injured succumbed to his injuries. Md Rakibul Alam, resident medical officer of Sadar Hospital, said the condition of two of the injured was critical. “They have been sent to Rangpur Medical College Hospital for better treatment,” he said.","04 Jun 2021, 00:21",https://en.prothomalo.com/bangladesh/accident/2-killed-6-hurt-in-thakurgaon-road-crash
2021-05-26,15:00:00,"27 May 2021, 09:07",head-on,Bhola,3.0,5.0,Bus,Auto Rickshaw,Road crash kills three in Bhola,"At least three people were killed and five others injured in a head-on collision between a passenger bus and an auto-rickshaw in Ginger Haat area on the Bhola-Charfashion road under Sadar upazila of the district Wednesday afternoon, reports BSS. The deceased were Aziz, 40, Miraj, 30, and Sohag, 12. Officer-in-charge (OC) of Bhala model police station Md Enayet Hossain told BSS that the bus left Bhola bus stand with passengers for Charfashion.  On the way, an auto rickshaw collided head-on with the bus coming from opposite direction in the area around 3:00pm, leaving three people dead on the spot and wounding five others, he added. The injured were sent to Sadar Hospital while critically injured three of them were referred to Barisal Sher-e-Bangla Medical College Hospital, the OC said. Supervisor of Bhola Sadar Hospital physician Md Sirajuddin said the bodies were kept at hospital for autopsy.","27 May 2021, 09:07",https://en.prothomalo.com/bangladesh/accident/road-crash-kills-three-in-bhola
