date_of_incident,time_of_incident,published-time,incident_type,location,death_count,injury_count,type_of_vehicle1,type_of_vehicle2,description_text,full_text,published-time,link
2020-03-03,,"03 Mar 2020, 22:41",Head-on,Begumganj,2.0,3.0,van,auto rickshaw,Three killed in separate road crashes,"Mother and daughter among three were killed in separate road crashes in Noakhali and Brahmanbaria on Wednesday, reports UNB.  In Noakhali, a schoolteacher and her daughter were killed and three other people injured in a road accident on Begumganj-Sonaimuri road in Begumganj upazila on Wednesday. The deceased were identified as Poly Majumdar, 26, a teacher of Mir Alipur Govt Primary School and her two-year-old daughter Nidhi. The accident took place at Salim Miar Dokan around 9:00am when a covered van hit an auto-rickshaw carrying five people, including Poly and her two daughters, leaving Poly and Nidhi dead on the spot and three other passengers injured, said Harun-Or-Rashid, officer-in-charge of Begumganj Police Station. The injured were taken to the local hospital. Poly met the tragedy while going to her school with her daughters from her house in Chowmuhani by the auto-rickshaw. In Brahmanbaria, a constable was killed when a truck ran him over on Dhaka-Sylhet highway at Khariala in Ashuganj upazila early Wednesday. The deceased was identified as Syed Hossain, 58, son of Mir Ahmed of Rangunia upazila in Chattogram district. A team of three policemen, including Syed, was on patrol in Ashuganj Toll Plaza area. In the dead of night, a goods-laden truck hit Syed while crossing the road on foot, leaving him dead on the spot. The body was sent to a local hospital morgue for autopsy.","03 Mar 2020, 22:41",https://en.prothomalo.com/bangladesh/accident/3-killed-in-separate-road-crashes
2020-03-03,,"03 Mar 2020, 19:06",Head-on,Gopalganj ,1.0,,van,motorcycle,Road crash kills army man,"A member of Bangladesh Army was killed in a head-on collision between a covered van and a motorbike on Tuesday, from which his wife and her friend escaped with serious injuries, reports UNB. The deceased was identified as Achintaya Kumar Biswas, 35, while the injured are his wife Bashona Biswas,30, and wife’s friend Juthi, 29. The three of them were on the motorcycle. Mukul Hossain, SI of Gopalganj Sadar Police Station, informed that the accident occurred at Tetulia of Ulpur Union in Gopalganj Sadar Upazila on Gopalganj-Tekerhat road around 4:00pm in the afternoon. The mishap occurred when lance corporal of Bangladesh Army Achintaya Kumar Biswas was going to village Aruakandi of Rajoir Upazila of Madaripur district along with his wife and wife’s friend. At this time, a speeding covered van coming from the opposite direction collided head on with the motorcycle killing the army member on the spot. Being informed, police rushed to the spot, recovered the body of the deceased and the injured and brought them to Gopalganj 250-bed General Hospital. The two seriously injured were admitted to the hospital. Son of Joydeb Biswas of village Kodombari under Rajoir Upazila of Madaripur district, Achintaya Kumar Biswas was working as lance corporal in Rangpur Cantonment. He came to his village home at Kodombari of Rajoir Upazila of Madaripur district on a two-month leave.","03 Mar 2020, 19:06",https://en.prothomalo.com/bangladesh/accident/road-crash-kills-army-man
2020-03-02,05:30,"02 Mar 2020, 04:34",head-on,Magura,3.0,,truck,human-hauler,Three killed in Magura road crashes,"Separate road accidents in Magura Sadar upazila left three people, including a student, dead and five others injured on Monday, reports news agency UNB. The deceased are Kiblu Mridha, 45, Yasin Molla, 25, and Bayzid Molla, 14. A truck collided head-on with a human hauler in front of the Parnanduali Mosque around 5:30am. Human hauler driver Kiblu was killed on the spot. Meanwhile, human hauler driver Yasin was killed and five others were injured after a truck hit his vehicle in Ghumgati area. In another incident, ninth grader Bayzid died after his motorcycle was hit by a human hauler in Pistopur area. Officer-in-Charge of Sadar police station Saiful Islam said the bodies had been sent to Sadar Hospital for autopsy. Three separate cases were filed over the accidents, he said.","02 Mar 2020, 04:34",https://en.prothomalo.com/bangladesh/accident/three-killed-in-magura-road-crashes
2020-03-01,05:30,"01 Mar 2020, 00:17",Head-on,Netrokona,6.0,20.0,truck,pickup van,6 high school students killed in road crash,"Six students were killed and 20 others injured after a pick-up van collided head-on with a truck in Durgapur upazila of Netrokona on Saturday night, reports news agency UNB. All those killed are students of Gauripur Hajee Amiruddin High School. Three of the deceased were identified as Arshadul, 14, Yasin, 8, and Hridoy, 17. Three of the injured are in critical condition, physicians said. Netrokona’s police chief Akbar Ali Munshi confirmed the casualties at a media briefing at 10:00pm. The accident took place around 9:00pm on Shamganj-Birishiri-Durgapur road at Kalapara market near Santipur village in the upazila. Forty-five students from Hajee Amiruddin High School, and Shalihar-e-Motaleb Beg Dakhil Madrasa, who had appeared in this year’s Secondary School Certificate (SSC) and equivalent exams, had come to visit Bijoypur on two pick-ups from Gouripur. They were returning home when one of pickups collided with a truck. Arshadul, Yasin, and Hridoy were killed on the spot, police said. A senior police officer of the district said they feared the death toll might rise. Meanwhile, 15 people were killed in separate road accidents in several other districts on Saturday.","01 Mar 2020, 00:17",https://en.prothomalo.com/bangladesh/accident/6-high-school-students-killed-in-road-crash
2020-02-29,07:45,"29 Feb 2020, 02:00",Lost Control,Cumilla ,3.0,15.0,Bus,,3 killed in Cumilla road accident,"Three people were killed and 15 others injured as a bus plunged into a roadside ditch in Daudkandi upazila of Cumilla on Saturday morning, reports UNB. The victims were identified as Shafiqul Islam, Shahin Mullah and Ramjan Ali. Abdullah Al Mamun, officer-in-charge of Daudkandi Highway police station, said the accident took place around 7:45am when the Dhaka-bound Khadiza VIP Paribahan bus skidded off the road and fell into the roadside ditch. The accident left three people dead on the spot and 15 others injured, he added.","29 Feb 2020, 02:00",https://en.prothomalo.com/bangladesh/accident/3-killed-in-cumilla-road-accident
2020-02-28,,"28 Feb 2020, 03:18",rear-end,Kashiani ,1.0,,microbus,pedestrain,Pedestrian killed in Gopalganj road crash,"A man was crushed under the wheels of a microbus on Dhaka-Khulna highway in Charchapta area in Gopalganj’s Kashiani upazila on Friday morning, reports UNB.  The deceased was identified as Md Idris Molla, 45, son of Imtaj Molla on Charchapta area.  Bhatiapara highway police camp sergeant Rezaul Karim said a speedy microbus hit Idris while he was crossing the road in the morning, killing him on the spot.","28 Feb 2020, 03:18",https://en.prothomalo.com/bangladesh/accident/pedestrian-killed-in-gopalganj-road-crash
2020-02-27,,"27 Feb 2020, 22:00",head-on,Pabna,2.0,3.0,truck,van,2 killed in Pabna road crash,"Two people were killed and three others injured in a collision between a covered van and a truck on Pabna-Dhaka highway at Madhupur in Ataikula upazila in Pabna early Friday, reports. The deceased are Abdul Hamid, 40 and Babu Hossain, 50 of the upazila. The accident took place around 5:30am when the Hajirhat-bound truck hit the covered van, leaving Abdul Hamid dead on the spot and four others injured, said sargent Aminul Islam, in-charge of Pabna highway police camp. The injured were taken to Pabna General Hospital where the physicians declared Babu dead.","27 Feb 2020, 22:00",https://en.prothomalo.com/bangladesh/accident/2-killed-in-pabna-road-crash
2020-02-22,,"22 Feb 2020, 22:26",,Gazipur,2.0,5.0,bus,,"Mother, daughter killed in road crash","A woman and her nine-month-old daughter were killed and five others injured in a road accident at Mouchak Aambagan area in Kaliakoir upazila of Gazipur on Sunday morning, reports UNB. The deceased were identified as Fatema Begum, 35, wife of Idris Ali and their daughter Arbi, residents of Boardghor area in the upazila. The accident took place on Dhaka-Tangail Highway when the bus fell into a roadside ditch, said sub-inspector Md Anwar Hossain of Salna-Konabari Highway police station. Fatema and her daughter were killed on the spot and five others injured. Police seized the bus but its driver managed to flee the scene, the SI added.","22 Feb 2020, 22:26",https://en.prothomalo.com/bangladesh/Mother-daughter-killed-in-road-crash-3
2020-02-19,07:30,"19 Feb 2020, 00:14",head-on,Jashore,1.0,15.0,bus,bus,Bus driver killed in Jashore road crash,"A driver was killed and 15 people were injured in a head-on collision between two buses on Navaran-Satkhira road at Harikeni in Sharsha upazila of Jashore on Wednesday, reports UNB. Details of the victim were not available. A Faridpur-bound picnic bus of ‘Green Bangla Paribahan’ carrying schoolboys and teachers from Satkhira hit another bus coming from the opposite direction around 7:30am, leaving one killed and 15 others injured, said in-charge of Navaran Highway Police Outpost, SI Zahirul Haque. Of the injured, four were sent to Jashore Medical College Hospital.","19 Feb 2020, 00:14",https://en.prothomalo.com/bangladesh/Bus-driver-killed-in-Jashore-road-crash
2020-02-14,11:00,"14 Feb 2020, 23:27",,Gazipur,2.0,10.0,bus,van,Road crash kill two in Gazipur,"Two people were killed and 10 others were injured in a road accident on Dhaka-Mymensingh Highway in Rajendrapur area of Gazipur on Saturday morning, reports UNB. The identities of the deceased could not be known immediately. Alamgir Bhuiyan, officer-in-charge of Gazipur police station, said the accident took place when a bus of Ena Paribahan hit a covered van from behind around 11:00am. Two passengers of the bus were killed on the spot and 10 others were injured. Police recovered the bodies and took the injured to Shaheed Tajuddin Ahmad Medical College Hospital, the OC said.","14 Feb 2020, 23:27",https://en.prothomalo.com/bangladesh/Road-crash-kill-two-in-Gazipur
2020-02-13,01:30,"13 Feb 2020, 21:51",Injured,Dhaka ,,40.0,bus,,"IU students, teachers among 40 injured in road crash","At least 40 people, including 37 students and two teachers of Islamic University, were injured in a road crash at Bittipara in Kushtia sadar upazila early Friday, reports UNB.  The two teachers are assistant professors of management department of the university Dhananjoy Kumar and Murshid Alam.  The accident took place around 1:30am when a bus carrying the students and teachers crashed into a roadside tree after hitting a stationary truck while heading towards the university from Naogaon, leaving 40 people injured, said Jahangir Arif, officer-in-charge of Islamic University police station.  Twelve of the injured, including the bus driver, were sent to general hospital while the others to the university medical centre.  The IU students and teachers had been to Naogaon on fieldwork on Wednesday. ","13 Feb 2020, 21:51",https://en.prothomalo.com/bangladesh/IU-students-teachers-among-40-injured-in-road
2020-02-13,,"13 Feb 2020, 22:59",,Khulna,5.0,5.0,bus,human haular,Road crash claims five lives,"Five people were killed and five others injured after a bus hit a human hauler (locally made vehicle) on Dhaka-Khulna highway at Pona Bus Stand in Kashiani upazila of Gopalganj on Friday, reports news agency UNB. The deceased were identified as Badi, 30, Mizan, 43, Sumon, 28, Sirajul and Layek of the upazila. The bus of ‘Falguni Paribahan’ hit the human hauler around 8:00am, leaving a passenger of the human hauler dead on the spot and nine others injured, said Azizur Rahman, officer-in-charge of Kashiani police station. The injured were taken Kashiani Upazila Health Complex, Faridpur Medical College Hospital and Sadar Hospital where four other people succumbed to their injuries. All of the victims are the construction workers from Parulia union of the upazila, said UP chairman Mukim Munshi.","13 Feb 2020, 22:59",https://en.prothomalo.com/bangladesh/Road-crash-claims-five-lives
2020-02-11,,"02 Nov 2020, 18:30",,Chandpur ,4.0,,Motorcycle,CNG Run Auto Rickshaw,3 killed in Chandpur road crash,"Three people were killed in Chandpur’s Faridganj upazila on Monday after a CNG-run auto-rickshaw hit a motorcycle, reports UNB. The deceased Jahid Hossain, 18, Raihan, 17, and Al Amin, 16, worked for a local internet service provider company. Their motorcycle collided head-on with a CNG-run auto-rickshaw, Officer-in-Charge of Faridganj police station Shahid Hossain said. Jahid died on the spot while Raihan and Al Amin died after being taken to the hospital. “We seized the vehicle and arrested the auto-rickshaw driver Monir, too,” Shahid Hossain said.","02 Nov 2020, 18:30",https://en.prothomalo.com/bangladesh/accident/3-killed-in-chandpur-road-crash
2020-02-11,,"11 Feb 2020, 21:56",,Rajshahi,2.0,,pickup,,2 killed in Rajshahi road crash,"Two people were killed and three others injured as a pickup crashed into a parked truck at Razabari intersection in Godagari upazila of Rajshahi on Wednesday, reports UNB. One of the deceased is Zahidul Islam, 18, son of Jalal Uddin of Char Chanlapur village in Savar upazila of Dhaka. The pickup hit the truck on Rajshahi-Chapainawabganj highway around 8am, leaving the duo dead on the spot and three other people injured, said Abdul Bari, in-charge of Premtoli police camp. The injured were taken to Godagari health complex.","11 Feb 2020, 21:56",https://en.prothomalo.com/bangladesh/2-killed-in-Rajshahi-road-crash-3
2020-02-10,,"02 Oct 2020, 04:28",Rear end,Sirajganj ,1.0,,Truck ,,Intern physician killed in Sirajganj road accident,"An intern of Bangamata Sheikh Fazilatunnesa Mujib General Hospital was killed in a road accident in Sirajganj Sadar upazila on Friday, reports UNB.    The accident took place in Saidabad area of ​​Bangabandhu Bridge West Highway.    The deceased was identified as Arafat Pathan (25), son of Haris Pathan of Bandia village of Bhaluka upazila in Mymensingh.     He was doing an internship after finishing MBBS from Shaheed M Mansur Ali Medical College. Bangabandhu Bridge West police station officer-in-charge (OC) Mosaddek Ali said Arafat was travelling to Sirajganj on a motorcycle. ""He died on the spot when he was hit by a truck from behind near the Saidabad road divider,"" Mosaddek said.  Upon receiving the news, police recovered the body and sent it to 250-bed Bangamata Sheikh Fazilatunnesa Mujib General Hospital morgue. Police seized the truck but the driver escaped, said Mosaddek. Shaheed M Mansur Ali Medical College principal Md Nazrul Islam said that after finishing his studies in March, Arafat was doing an internship at Bangamata Sheikh Fazilatunnesa Mujib General Hospital. ","02 Oct 2020, 04:28",https://en.prothomalo.com/bangladesh/accident/intern-physician-killed-in-sirajganj-road-accident
2020-02-07,22:00,"07 Feb 2020, 21:43",,Chattogram ,4.0,14.0,bus,,Road crash kills 4 in Cox’s Bazar,"Four people were killed and at least 14 others were injured as a bus plunged into a ditch by the Cox’s Bazar-Chattogram highway in Baniarchhara Dhala area in Chakaria upazila, Cox’s Bazar on Friday night. One of the deceased was identified as Jharna Begum, 35, from Sonadia village in Hatia, Noakhali. The accident took place around 10:00pm when the Cox’s Bazar-bound ‘Star Line Paribahan’ bus fell into the roadside ditch, said Md Anisur Rahman, inspector of Chiringa Highway police outpost. Four people were killed on the spot while 14 others sustained injuries, he added. The injured were taken to the upazila health complex and other local clinics. UNB adds: Police recovered the bodies and kept them at Harbang Highway police outpost. Road accidents claim thousands of lives in Bangladesh every year. Last year, the country saw at least 5,516 road accidents in which 7,855 people were killed, Bangladesh Jatri Kalyan Samity said. At least 13,330 others injured in the accidents.","07 Feb 2020, 21:43",https://en.prothomalo.com/bangladesh/Road-crash-kills-4-in-Cox%E2%80%99s-Bazar
2020-01-27,12:45,"27 Jan 2020, 02:15",,Dhaka ,1.0,,pedestrain,car,"Student killed by lorry, protesters block road","The students of Wari High School blocked the road in protest of a fellow student being hit and killed by a WASA lorry near Baldha Garden in the capital on Monday. The deceased, Abeer, was a SSC examinee this year. Traffic came to a halt on the Wari road as students took to the street right after the incident. A number of policemen have been deployed on the spot. The accident took place at around 12:45pm on Monday, confirmed the assistant commissioner Wari traffic zone Tariqul Islam. Police have arrested the lorry driver. According to police and locals, the lorry hit Abeer while it was entered the main road after filling up with water from the WASA water pump near Baldha Garden. The victim was rushed to the hospital immediately where the doctors pronounced him dead.","27 Jan 2020, 02:15",https://en.prothomalo.com/bangladesh/Student-killed-by-lorry-protesters-block-road
2020-01-22,,"22 Jan 2020, 20:32",,Dhaka ,2.0,,motorcycle,motorcycle,2 motorcyclists killed in road crash,"Two motorcyclists were killed as a truck crashed into their bike at the Madrasa intersection in Gomastapur upazila of Chapainawabganj district on Wednesday morning, reports UNB. The deceased were identified as Habibur, 38, son of Ayub Ali, and Mozahar, 35, son of Saiful Islam. Jasim Uddin, officer-in-charge of Gomastapur Police Station, said the truck hit the motorcycle around 11:30am, leaving the duo critically injured. They died on the way to Rajshahi Medical College Hospital around 2:00pm.","22 Jan 2020, 20:32",https://en.prothomalo.com/bangladesh/2-motorcyclists-killed-in-road-crash-2
2020-01-21,18:30,"21 Jan 2020, 06:11",,Keraniganj,4.0,2.0,motorcycle,auto rickshaw,4 killed in Keraniganj road crash,"Four people were killed and two others injured in a road crash at Hazratpur in Keraniganj, Dhaka on Tuesday, reports news agency UNB.The identities of the deceased could not be known immediately.The accident took place around 6:30pm when an auto-rickshaw hit a motorbike, killing three people on the spot and three others injured, said Kazi Mainul Islam, officer-in-charge of Keraniganj Model police station. The injured were taken to Enam Medical College and Hospital, Savar where the doctors declared one of the injured dead.","21 Jan 2020, 06:11",https://en.prothomalo.com/bangladesh/4-killed-in-Keraniganj-road-crash
2020-01-20,19:00,"20 Jan 2020, 22:58",,Dhaka ,1.0,,pedestrain,bus,Road crash kills elderly woman,"An elderly woman was killed after being hit by a bus in the city’s Shanir Akhra area on Monday evening, reports UNB. The deceased was identified as Nurjahan Begum, 65, wife of late Shamsuddin of Swamibagh under Gendaria police station. Victim’s son Mohammad Shahid said the bus hit his mother in front of Mollah College around 7:00pm when she was on her way to his sister’s place in Rayerbagh area. Being informed by locals, he rushed in and took her to Dhaka Medical College Hospital (DMCH) where doctors declared her dead, he said, adding that locals seized the bus. Inspector Bachchu Mia of the DMCH police outpost said the body has been kept at the morgue for autopsy.","20 Jan 2020, 22:58",https://en.prothomalo.com/bangladesh/Road-crash-kills-elderly-woman
2020-01-18,01:00,"17 Jan 2020, 21:06",Lost Control,Jashore ,3.0,3.0,Car,,Jashore car accident kills 3 of a family,"Three members of a family were killed and three others were injured in a car accident in Jashore town in the small hours of Saturday, reports news agency UNB. The deceased were identified as sisters Tonima Yeasmin Piyasha, 25, wife of a certain Shafiqul Islam, and Tanjila Yeasmin Easha, 30, wife of Sumon and their sister-in-law Tithi, 35, wife of Monjur Hossain. The accident took place around 1:00am when the car hit an electric pole, leaving the three dead on the spot, said Md Touhidul Islam, assistant superintendent of police in Jashore. Among the injured, the condition of three-year-old Monirul had deteriorated. He was sent to Dhaka for better treatment. It is unclear what caused the accident, he added.","17 Jan 2020, 21:06",https://en.prothomalo.com/bangladesh/Jashore-car-accident-kills-3-of-a-family
2020-01-17,,"17 Jan 2020, 00:03",head on,,2.0,,bus,bus,Collision between two buses claims two lives,"Two people were killed and 10 others injured on Friday as two buses collided head-on in Shantirhat area of Patiya upazila, Chattogram, reports news agency UNB.The identities of the deceased could not be known yet. Officer-in-charge of Patiya highway police Bimal Chandra Bhowmik said a bus of Shyamoli Paribahan collided head-on with another bus in Shantirhat around 10:45am, killing two people on the spot. Six among the injured were taken to the Chattogram Medical College Hospital (CMCH), he said. Police seized the two buses from the spot, he added.","17 Jan 2020, 00:03",https://en.prothomalo.com/bangladesh/Collision-between-two-buses-claims-two-lives
2020-01-16,23:30,"16 Jan 2020, 23:53",,Dhaka ,2.0,,pedestrain,bus,Road crash kills 2 in Dhaka,"A man and his nephew were killed in a road accident in front of Saddam Market in the city’s Jatrabari area on Thursday night, reports UNB.The deceased were identified as Anwar Hossain, 40 and his nephew Salauddin, 23 of Bhuigarh in Fatulla of Narayanganj district. The accident took place around 11:30pm when a bus hit them while they were crossing a road, leaving them dead on the spot, said Ahmed Nawazi, sub-inspector of Jatrabari police station.","16 Jan 2020, 23:53",https://en.prothomalo.com/bangladesh/Road-crash-kills-2-in-Dhaka
2020-01-12,15:30,"12 Jan 2020, 04:19",,Khulna,5.0,,bus,human hauler,Five killed as bus hits human hauler,"At least five people were killed and two others injured as a bus collided with a human hauler in Rajbari on Dhaka- Khulna on Sunday, reports UNB.The identities of the deceased could not be known yet Masud Parvez, inspector of Goalanda intersection highway police, said the Dhaka-bund bus of Greenlline Paribahan hit the Goalanda-bound human hauler at 3:30pm, killing five people, including two women, on the spot. The injured were taken to Sadar Hospital, he said.","12 Jan 2020, 04:19",https://en.prothomalo.com/bangladesh/Five-killed-as-bus-hits-human-hauler
2020-01-11,21:45,"11 Jan 2020, 21:54",,Chattogram,2.0,,microbus,motorcycle,"Microbus hits motorcycle, kills two youths","Two motorcyclist were killed as a microbus crashed into their bike in Lohagara upazila in Chattogram on Saturday night, reports UNB. The deceased were identified as Bishal Barua, 18, a grille workshop employee and Uttam Barua, 24, a cycle mechanic of Adhunagar Chhedirpunipara in the upazila. Officer-in-charge of Dohazari highway police station Mohammad Yasin Arafat said the Chattogram city-bound microbus hit the motorcycle in front of Mustafizur Rahman Degree College on Chattogram-Cox’s highway around 9:45pm, leaving the two bikers dead on the spot. The victims were returning home from the upazila headquarters when the accident took place, he said.","11 Jan 2020, 21:54",https://en.prothomalo.com/bangladesh/Microbus-hits-motorcycle-kills-two-youths
2020-01-07,12:00,"01 Jul 2020, 07:50",Overturned,Rangpur,4.0,1.0,Truck,,Road accident kills 4 in Rangpur,"Four transport workers were killed and another was injured in a road accident at Anantapur point on the Taraganj-Burirhat road in Taraganj upazila of Rangpur district on Wednesday. The deceased is Anil Chandra, 60, of Dorjipara village and Khoyrat Hossain, 55, of Kishoreganj upazila in Nilphamari, Abu Bakar Siddique, 52, and Farhad Hossain, 28, Kursha Dolapara in Taraganj upazila of Rangpur, reports news agency UNB. The accident took place when a iron rod-laden truck overturned and fell down into a roadside ditch there at noon, killing four transport workers on the spot and injuring another, said Zinnat Ali, officer-in-charge of Taraganj police station. On information, police rushed to the spot, recovered the bodies. “Driver and helper of the truck fled from the scene,” said the OC said, adding that they seized the truck. A case was filed in this connection with Taraganj police station. According to Bangladesh Jatri Kalyan Samity, a passengers’ welfare platform, 8,543 people were killed and 14,318 others injured in 6,210 road, railway and waterway accidents across the country in 2019.","01 Jul 2020, 07:50",https://en.prothomalo.com/bangladesh/accident/road-accident-kills-4-in-rangpur
