date_of_incident,time_of_incident,published-time,incident_type,location,death_count,injury_count,type_of_vehicle1,type_of_vehicle2,description_text,full_text,published-time,link
2021-01-16,,"19 Jan 2021, 04:48",,Dhaka,,26.0,,,35pc of accidents are on motorbikes,"There were 26 patients, injured in road accidents, in the corridor in front of the operating theatre of the National Orthopaedic Hospital and Rehabilitation Institute (Pangu Hospital) in the capital city last Saturday. Of these patients, 12 were injured in motorbike accidents. The hospital authorities say that a large percentage of the road injury cases are the victims of motorbike accidents nowadays. Persons researching on road accidents said that motorbike accidents are mainly caused by reckless speeding, attempts to overtake, repeated lane changes, violation of traffic rules and talking on the mobile phone while on the move. The number of deaths is also increasing due to low quality helmets or not wearing helmets at all. Pedestrians also fall victim to accidents due to reckless speed of motorbikes. Shamsul Alam, a member of the General Economics Department of the Planning Commission, was such a victim. He had an accident last Saturday evening while walking in the Crescent Lake area next to the Jatiya Sangsad Bhaban. He told Prothom Alo that he was hit by a speeding motorcycle while crossing the road. His right leg was broken in the accident. At Pangu hospital The National Orthopaedic Hospital and Rehabilitation Institute, better known as Pangu hospital, is the largest institute in the country for the treatment of fractured bones. Its official name is name is National Institute of Traumatology and Orthopedic Rehabilitation (NITOR). Inquiries at the hospital's emergency department revealed that 34 people have received treatment after being injured in road accidents till 1 pm on Saturday. Among them, 16 were the victims of motorcycle accidents. Some were driving the bikes, some were passengers riding pillion and some were pedestrians. According to the five registrar books of the emergency department, 2484 people received treatment at the hospital in the first 16 days of the new year. Of them, 585 were victims of road accidents. There is no mention of how many of them were the victims of motorbike accidents. However, Prof Abdul Gani Mollah, director of NITOR, told Prothom Alo that 35 per cent of the road accidents cases at NITOR are victims of motorcycle accidents. He said most of the patients come from outside the capital. In recent times, the number of people injured in motorcycle accidents while sharing rides is also increasing. University student Naimul Islam went to NITOR on Sunday with a fractured his arm. He frankly admitted that he had the accident due to over speeding while riding with a friend. He told Prothom Alo that his motorcycle was over-speeding and control on the sand on the road. Even the general motorcycle drivers are worried about reckless driving. Md Nayeem Hasan, who works for a private firm, returns his home to Mirpur from his office in Banani every night. He said that motorbikes and cars race each other. This has become a major cause of fear for the ordinary motorcyclists. How many vehicles, how many accidents? According to the Bangladesh Road Transport Authority (BRTA), the number of registered motorcycles in the country is more than 3.1 million, which is 68 per cent of the total vehicles. There are about 800,000 registered motorcycles in Dhaka alone. Outside of that a large part of the motorcycles are unregistered. According to the marketing companies, about 500,000 new motorcycles are sold in the country every year. The Accident Research Institute (ARI) of Bangladesh University of Engineering and Technology and the organisation for the advocacy of safe roads Nirapad Sarak Chai (Nischa) compile reports of accidents published in the media every year. According to Nishcha, there were 3232 road accidents in the country in 2020, of which 1,127 were motorcycle accidents. Of these, 29 per cent involved truck accidents and 22 per cent bus accidents. According to BUET's ARI, 336 people died in 288 motorcycle accidents in 2016. In 2020, the number of accidents raised to 1,008 and 1,097 people died in these accidents. A 2007 study by the World Health Organization (WHO) found that wearing a good quality helmet reduces the risk of serious injury in a motorcycle accident by 70 per cent. And the risk of death is reduced by 40 percent. Regarding the trend of not wearing a helmets outside the big cities, the Assistant Inspector General of Police (Media and Public Relations), Sohail Rana, said that action is being taken in accordance to the law for not wearing helmets. Various awareness programmes are also being arranged. Ride sharing has increased In Dhaka, motorbike ride sharing has increased exponentially in the last few years. Many people who are not even registered with ride-sharing companies, also carry passengers on their motorcycles. ARI conducted a survey of the riders and passengers of 450 ride sharing motorcycles in 2020. It revealed that 50 per cent of the passengers suffer from insecurity regarding the driving. According to another survey conducted by the same organisation, 30 per cent of the drivers wear very low quality helmets. In only 2 per cent of the cases, riders are given ‘full face’ helmets. According to ARI's observation, the competition of ride-sharing motorcycle riders and the tendency to race ahead are the main causes of accidents. On Sunday, Prothom Alo sent e-mails to the authorities of three ride sharing apps asking the number of accidents of their vehicles. Uber did not disclose the number of accidents, but answered the question. They said they pay Tk 200,000 for death and permanent disability in an accident and a maximum of Tk 100,000 for hospitalisation. Uber said they encourage the use of the best quality helmets. Pathao (ride sharing app) did not reply to the e-mail. However, Maliha Malek, the managing director of Shohoj dot com, told Prothom Alo over mobile phone that they did not have any reports of the their ride-sharing app bikes having any accident. What are the riders and sellers saying? A review by a multinational motorbike marketing company has revealed that overtaking is one of the major causes of motorcycle accidents. Apart from this, fatigue and rushing are also the main reasons for the accidents. Reckless driving of buses, trucks, ‘human hauler’ passenger vehicles and cars , sudden lane changes, sudden turning and lane changing of non-motorised vehicles, sudden potholes in the road, high or low covers of manholes, unmarked speed breakers, carelessness of pedestrians and sudden movement of animals on the road are also some big reasons behind road accidents. For example, Akash Iqbal (26) and his wife Maya Hazarika (25) were killed when a bus of Ajmeri Paribahan hit them on Airport Toad in the capital yesterday. Top two executives of the two companies told Prothom Alo that sales of the motorcycles as personal vehicles are increasing in developing countries. Motorcycle sales will also increase in Bangladesh like Indonesia, Vietnam, Thailand and India. Public-private initiatives are needed to reduce the number of accidents. They also said that there is no effective system of training the motorcyclists in the country. Awareness and training initiatives should be taken in combination with the private sector. People should be encouraged to buy high-tech motorcycles with a good security systems. Shah Mohammad Ashiqur Rahman, the chief financial officer of Honda Bangladesh Limited, said the number of accidents had increased in Japan once. Later they reduced it with various measures. He said Honda provides the driving license on behalf of the governments in many countries. They are also providing training in Bangladesh. Plastic bowls in the name of helmets Sajjadul Bari, Director (Standards) of Bangladesh Standards and Testing Institution (BSTI), told Prothom Alo yesterday that BSTI does not have the facility to check the quality of helmets at present. However, all the helmets sold in the market are supposed to be manufactured and imported as per the standards prescribed by the BSTI. Due to the lack of surveillance by BSTI, one portion of the helmets sold in the market is basically just plastic bowls. Regarding the overall scenario, ARI’s director Hadiuzzaman told Prothom Alo that ensuring good quality helmets for both the bikers and the riders, reducing the competition among the drivers of ride sharing apps, raising awareness and strictly enforcing traffic laws can reduce motorcycle accidents.","19 Jan 2021, 04:48",https://en.prothomalo.com/bangladesh/accident/35-of-accidents-are-on-motorbikes
2021-01-03,13:30:00,"03 Jan 2021, 02:04",head-on,Mymensingh,7.0,,Bus,Auto Rickshaw,7 killed in Mymensingh road accident,"Seven people were killed after a bus hit an auto-rickshaw at Gachtala in Tarakanda upazila of Mymensingh on Sunday, reports UNB.  The identities of the deceased could not be known immediately.   Seven passengers of the auto-rickshaw were killed on the spot after a Netrakona-bound bus from Dhaka hit the Mymensingh-bound three-wheeler around 1:30pm, said Abul Khayer, officer-in-charge of Tarakanda police station. A firefighting unit from Mymensingh and police went to the spot and conducted the salvage operation. The bodies were taken to Mymensingh Medical College and Hospital. ","03 Jan 2021, 02:04",https://en.prothomalo.com/bangladesh/accident/7-killed-in-mymensingh-road-accident
2021-01-01,16:00:00,"01 Jan 2021, 05:06",head-on,Narsingdi,4.0,1.0,Car,Bus,Four killed in Narsingdi road accident,"Four people were killed and one injured as a private car collided head-on with a bus at Dhaka-Sylhet highway in Belabo upazila in Narsingdi on Friday. The accident took place at Jangua area in Narayanpur union at around 4:00pm. Bhairab highway police station’s sub inspector Delwar Hossain said the name of the victims could not be confirmed immediately. Three of the victims were female and one male, he added. Police, witnesses and local people said the accident took place when a Sylhet-bound bus of Al Mobarak Paribahan tried to overtake another bus. Bhairab highway police later recovered the bodies from the car. Locals later took a female passenger of the car to Dhaka Medical College Hospital.","01 Jan 2021, 05:06",https://en.prothomalo.com/bangladesh/accident/four-killed-in-narsingdi-road-accident
,05:30:00,"04 Mar 2021, 08:18",,Dhaka,3.0,,Truck,Pedestrian,Road crashes kill 3 in Dhaka,"Three people were killed in road accidents in Dhaka's Khilkhet, Postagola Bridge and Jatrabari areas on Thursday.  The deceased were identified as Ashik Abdullah Helal, 42, in-charge of a private security guard company, Prasenjit, 30, a toll collector, and Abdul Kader Mia, 60. Police said Ashik was talking with a security guard near Police Housing - located at 300 feet road under Khilkhet police station - at around 5:30am.  Then a speedy drum truck appeared out of nowhere and fled the scene hitting Ashik. Ashik - who would live in the Police Housing project area - died on the spot, said sub-inspector Md Shamimul Islam of Khilkhet police station.  Toll collector Prasenjit sustained serious injuries while chasing an oil-laden Dhaka-bound lorry from Mawa.  ""The lorry driver was trying to flee without paying a toll of Tk 700. Prasenjit chased the vehicle and at one stage he climbed on it,"" the deceased's colleague Arman Hossain said.  ""When Prasenjit asked for the toll money, he was thrown from the moving vehicle 3:30 am at the Postagola Bridge area."" A critically injured Prasenjit was rushed to the Dhaka Medical College Hospital (DMCH) where he succumbed to injuries at around 4:00 am, Arman said.  DMCH police outpost in-charge inspector Bachchu Mia said the body was sent to the DMCH morgue for autopsy. Meanwhile, another victim Abdul Kader Mia was seriously wounded when a speedy motorcycle hit him while he was crossing the Bhangapress Road in Jatrabari at around 4:00 pm.  Kader was rushed to the DMCH where he was declared dead at around 5pm.  The victim's nephew Alauddin said, ""My uncle came to my house to attend my daughter's wedding, which is scheduled to take place on Friday.""  ""We went to Bhangapress Bazar to buy a goat in the afternoon. As we were returning on foot after buying a goat, a motorcycle coming from the opposite direction hit my uncle when he was crossing the road,"" Alauddin said.  Bachhu Mia said, ""Kader's body was sent to the hospital morgue for autopsy. Rajan Pathan, the motorcyclist, has been interrogated at the police camp.""","04 Mar 2021, 08:18",https://en.prothomalo.com/bangladesh/accident/road-crashes-kill-3-in-dhaka
,,,,,,,,,,,,
,21:15:00,"03 Mar 2021, 19:28",,Faridpur,3.0,,Bus,MicroBus,Three killed in Faridpur road crash,"Three people including wife of Faridpur's Nagarkanda municipality mayor Nimai Chandra Sarkar and their son were killed as a bus hit a microbus carrying the mayor and his family on Wednesday night. The accident took place on Dhaka-Khulna Highway at Kalai intersection of Bhanga upazila at around 9:15pm. Injured mayor Nimai Chandra was admitted to Faridpur Medical College Hospital. Locals said Nimai Chandra was travelling to Bhanga with his family when their microbus was hit by a Dhaka-bound bus of GS Paribahan. His wife Sanchita Sarkar, 45, and their neighbour Kamal, 40, died on the spot while Nimai Chandra and his son Gobinda Sarkar, 25, were injured critically. Gobinda succumbed to his injuries as they were rushed to the upazila health complex. Mayor Nimai Chandra was later shifted to Faridpur Medical College Hospital. Bhanga Highway police station officer-in-charge Omar Faruk confirmed this to media.","03 Mar 2021, 19:28",https://en.prothomalo.com/bangladesh/accident/three-killed-in-faridpur-road-crash-2
,,"28 Feb 2021, 18:56",head-on,"Lakshmipur Sadar, upazila",3.0,,pickup van,Pedestrain,"Mother, daughter among three killed in Lakshmipur road crash","Three persons, including a woman and her daughter, were killed as a soil-laden pickup van ran over them and plunged into a roadside ditch after its driver lost control in Charchamita area of the Lakshmipur Sadar upazila, BSS reports. The deceased were identified as Rahela Begum ,50, wife of late Mohammad Babul of Charchamita village, her daughter Jannat (11) and Mohammad Masum (10), son of one Jahangir Alam of Begumganj upazila of Noakhali district. According to the eye witnesses, the pickup van ran over them and plunged into the ditch when the three were planting banana trees on the roadside. The victims were taken to Noakhali General Hospital with critical injuries while Rahela Begum breathed her last on the way to the hospital, they said, adding that the physician declared Jannat and Masum dead after they were taken to the health facility. Sub-inspector (SI) of Chandraganj Highway Police Station Kawser Ahmed confirmed the incident and said the bodies will be handed over to the victims ‘families after completing legal procedure and autopsy. The pickup van, however, was seized from the spot, he said.","28 Feb 2021, 18:56",https://en.prothomalo.com/bangladesh/accident/mother-daughter-among-three-killed-in-lakshmipur-road-crash
,20:00:00,"28 Feb 2021, 18:47",crash,Sitakunda,2.0,,motorcycle,"Human Hauler, mini bus",2 killed in Sitakunda road crashes,"At least 2 persons were killed in separate road crashes in Sitakunda on Sunday, reports UNB. The deceased were identified as Shams Tahiyat Maunota (16), a class 10 student of Bangladesh Military Academy High School and Touhidul Islam Jafor (51), an assistant teacher at Sadak Mastan (RA) High School in Fakrihat Upazila. According to the highway police and locals, Maunota was hit by a minibus in Kasem jute mill area, while she was returning home in the morning. She was taken to the hospital by locals where she died at around 12:00pm. Baro Aulia Highway Police Station sub-inspector (SI) Babul Miya said, “We seized the bus after we came to know about the accident. The locals handed over the bus and its driver to the police.” Touhidul was killed as he was hit by a motorcycle on Saturday night. The incident took place at Sarij Bhuiyan Road in the upazila around 8:00pm on Saturday. Although he was rescued and rushed to a hospital in Chittagong, he died at 12:30 am. Abu Zafar Saad, the headmaster of the Sadak Mastan High School, said Tauhidul was hit by an unidentified vehicle as he was crossing the road at night.","28 Feb 2021, 18:47",https://en.prothomalo.com/bangladesh/accident/2-killed-in-sitakunda-road-crashes
,12:00:00,"27 Feb 2021, 03:11",head-on,Barisal-Dhaka,,,motorcycle,Bus,Barishal road crash leaves one dead,"A motorcyclist was killed being hit by a bus on Barisal-Dhaka highway on Saturday, reports UNB.  The deceased was identified as Mubarak Hossain Hawlader, 60, hailing from Pangsha area of ​​Barishal sadar and a retired field officer of the National Intelligence Agency (NSI), said Babuganj fire station leader Nuruzzaman Sharif. According to the locals, a Dhaka-bound 'Sakura Paribahan' bus hit the motorbike at a place between Barisal Cadet College and Palli Bidyut Samiti office on the highway, leaving him dead on the spot. However another source said that the motorbike was first hit by a sand-laden truck. When he fell on the road, the speeding ran over him. Locals stopped the bus in Rahmatpur Bridge area but the driver and the helper managed to flee.  Officer-in-charge (OC) of Barisal metropolitan airport police station Zahid Bin Alam said the body has been recovered from the spot and legal action will be taken. ","27 Feb 2021, 03:11",https://en.prothomalo.com/bangladesh/accident/barishal-road-crash-leaves-one-dead
,09:00:00,"25 Feb 2021, 19:51",Ran over,Dhaka,7.0,,Bus,Bus,At least seven killed in Sylhet road crash,"At least seven people killed in a head-on collision between two buses on Dhaka-Sylhet highway in Rashidpur area of Sylhet on Friday morning, police said. Dakshin Surma police and fire service members rushed to the scene and started rescue operations. Additional deputy commissioner (media) of Sylhet metropolitan police, ABM Ashraf Ullah, said police got information of at least seven deaths so far. The number of casualties might rise, he added. According to police and fire service, a Dhaka-bound bus of Ena Paribahan collided head-on with a bus of London Express coming from Dhaka in Rashidpur area of Sylhet. A local source said, drivers of both the buses were killed in the accident. Traffic movement was halted on both sides of the route after the accident.","25 Feb 2021, 19:51",https://en.prothomalo.com/bangladesh/accident/at-least-seven-killed-in-sylhet-road-crash
,07:00:00,"21 Feb 2021, 23:00",head-on,"Harishpur ,Natore",1.0,,Bus,Pedestrain,Policeman killed in Natore road crash,"A policeman was killed in a road accident at Harishpur in Natore district town on Monday, UNB reports. The deceased was identified as Bishnupado, sub-inspector of Natore Court Police. Abdul Matin, officer-in-charge of Natore Police Station, said the accident took place around 7:00am when a bus knocked down Bishnupado while he was walking, leaving him injured. Later, he was taken to a local hospital where physician declared him dead. Police could not arrest the bus driver as he managed to flee the scene.","21 Feb 2021, 23:00",https://en.prothomalo.com/bangladesh/accident/policeman-killed-in-natore-road-crash
,08:00:00,"09 Feb 2021, 00:48",head-on,Natore,1.0,,truck,microBus,Road crash kills 1 in Natore,"A driver of Ruppur Neuclear Power plant was killed and a Russian officer of the project was injured as a truck hit a microbus on Natore-Pabna highway at Gunaihati in Natore’s Baraigram upazila on Tuesday, reports UNB. The deceased was identified as Touhidul Islam Sagar, driver of the microbus. Shafiqul Islam, officer-in-charge of Banpara highway police station, said a microbus carrying Russian officer Shergai Garzina of Ruppur Nuclear Power plant was heading towards Dhaka in the morning. When the microbus reached Gunaihati area, a truck coming from the opposite direction hit the microbus, leaving the driver and the Russian officer of the power plant injured. The injured were taken to Boraigram upazila health complex where physicians declared Touhidul dead. On information, police and a team of firefighting unit went to the spot.","09 Feb 2021, 00:48",https://en.prothomalo.com/bangladesh/accident/road-crash-kills-1-in-natore
,12:30:00,"08 Feb 2021, 08:47",Lost-control,Dhaka,1.0,,motorcycle,,Man killed in city road crash,"A man was killed and his son was injured after he lost control over his motorcycle in Airport area of Dhaka-Mymensingh highway on Monday afternoon, reports UNB. The deceased was identified as Yunus Bepari, 68, said Bachchu Bhuiyan, in-charge of Dhaka Medical College Hospital (DMCH) police out-post. The accident occurred at 12:30 pm in the afternoon when the duo were returning to their home after visiting a relative in Kathalbagan area of the city, he said. Yunus was rushed to Bangladesh Medical Hospital in Uttara and later shifted to DMCH in the evening, where doctors declared him dead. The body was sent to hospital morgue for autopsy, Bhuiyan said.","08 Feb 2021, 08:47",https://en.prothomalo.com/bangladesh/accident/man-killed-in-city-road-crash
,08:00:00,"05 Feb 2021, 07:38",head-on,"Narayanganj,Dhaka",3.0,,Bus,Pedestrain,3 pedestrians die in Narayanganj road mishap,"Three pedestrians were killed as a bus crushed them in Kanchpur bus stand area this morning, reports BSS.  The deceased were identified as Abu Bakar Siddique, 20, hailed from Kachpur area, Ohidul, 32, an inhabitant in Rangpur district and Sojib Sarker, 28, a resident in Chandpur district. The bus ran over them when they were crossing the Dhaka-Chattogram Highway in the aforesaid area around 11:30am, said Moniruzzaman, officer-in-charge of Kanchpur highway police station. The pedestrians were taken to a nearby hospital where they died, he said, adding the bodies were sent to Narayanganj General Hospital morgue.","05 Feb 2021, 07:38",https://en.prothomalo.com/bangladesh/accident/3-pedestrians-die-in-narayanganj-road-mishap
,,"05 Feb 2021, 00:30",head-on,"Chattogram,Bakoliya",3.0,,auto-rickshaw,truck,Chattogram road crash kills 3,"At least three people were killed and five others injured as a truck collided head-on with a CNG-run auto-rickshaw at Bakolia in Chattogram city on Friday, reports UNB.  Identities of the deceased could not be confirmed immediately, said Md Moinuddin, officer-in-charge (OC) of Bakolia Police Station . ""All the injured and deceased were the passengers of the auto-rickshaw. Their bodies have been sent to the morgue for autopsy,"" the OC added. ","05 Feb 2021, 00:30",https://en.prothomalo.com/bangladesh/accident/chattogram-road-crash-kills-3
,,"04 Feb 2021, 18:39",head-on,Dhaka,1.0,,bus,pedestrain,Jatrabari road crash: 60-year-old man killed,"A man, aged around 60, was killed on Thursday as a passenger bus hit him in Jatrabari of Dhaka. The incident took place in the afternoon when a bus of Utshab Paribahan knocked the 60-year-old Siddiqur Rahman down. He was from Chandpur and lived in Naryanganj. The pedestrians rescued him in a critical condition and rushed him to Dhaka Medical College Hospital (DMCH) where he was declared dead at around 6:15pm, Jatrabari Police Station sub-inspector Bishawjit Sarker said. “The on-duty police sergeant seized the bus, but its driver managed to flee the scene,” Bishawjit said. “Siddiqur’s body has been kept at DMCH morgue for autopsy.”","04 Feb 2021, 18:39",https://en.prothomalo.com/bangladesh/accident/jatrabari-road-crash-60-year-old-man-killed
,05:00:00,"04 Feb 2021, 07:49",crash,Chattogram,1.0,,Truck,motorcycle,ASI killed in Chattogram road crash,"An assistant sub-inspector (ASI) of police was killed after being hit by a truck in Kumia area of Sitakunda early Thursday, reports UNB.  The deceased was identified as Nipon Chakma, 47, son of Ranjan Chakma. He was posted at Feni district police lines.  Inspector Md Alamgir Hossain of Kumira highway police said a Chattogram-bound truck hit the motorcycle of Nipon around 5:00 am, killing him on the spot.  Police have arrested the truck driver and his assistant, he said. Road accidents continue to rise in Bangladesh with the country seeing 439 deaths in 417 accidents in November 2020, according to Road Safety Foundation (RSF), an organisation working to ensure safer roads.  A World Bank report published in February, 2020 said Bangladesh needs to invest an estimated extra $7.8 billion over the next decade to halve its road crash fatalities.","04 Feb 2021, 07:49",https://en.prothomalo.com/bangladesh/accident/asi-killed-in-chattogram-road-crash
,10:00:00,"01 Feb 2021, 18:43",head-on,Rangamati sadar .,1.0,,motorcycle,jeep,Man killed in Rangamati road crash,"A man was killed as his motorcycle collided with a jeep head-on in Rangamati sadar on Monday, reports UNB. The deceased was identified as Usimong Marma, a resident of Kaptai upazila and an NGO worker of Rangamati Jum Foundation. Police and locals said the accident occurred near the Deppochari area of Shapchari union around 10:00am. Usimong was going to his workplace from Kaptai when his motorcycle collided head-on with a jeep killing him on the spot. Police seized of the jeep from the spot. Usimong’s body was sent to a hospital for an autopsy. No case was filed in this connection yet.","01 Feb 2021, 18:43",https://en.prothomalo.com/bangladesh/accident/man-killed-in-rangamati-road-crash
